name,message
Elijah Parker,here
Elijah Parker,have a punk lad
Elijah Parker,I like his whole fit
Elijah Parker,and his hair actually.
Elijah Parker,too bad I'm Jewish :(:(
J Cole Patt,RIP
J Cole Patt,shit slaps when ur high
Elijah Parker,what u on about?
J Cole Patt,musix
Elijah Parker,there's no music in that video.
Elijah Parker,There's no sound at all actually.
J Cole Patt,oof
Elijah Parker,👀
Elijah Parker,Where u goin?
Austin Medina,Sup niggus
Austin Medina,We having a superbowl party?
Elijah Parker,When's the Superbowl lol
J Cole Patt,no sound?
Elijah Parker,nope
Elijah Parker,at least not for me from my ear buds or phone speaker
Elijah Parker,Also. I don't really care about the super bowl but it'd be cool to chill with you guys.
Elijah Parker,If you want me to that is. I understand if not.
Degan Nestrichal,no eli u cant cum if u dont know anything about foosball!!
Elijah Parker,:(:(
Samuel Adams,Chad Tom Brady vs Virgin Mahomes!
J Cole Patt,Am mexican
Degan Nestrichal,damn J went to supercuts
J Cole Patt,went to my aunts place
Samuel Adams,Is it fair to say that Harvester of Sorrow is Metallica's heaviest song
Samuel Adams,Both in rhythm and lyrical content
Degan Nestrichal,fight fire with fire
Samuel Adams,"That's their most thrashy for sure, Dyer's Eve being a close second"
Samuel Adams,But HoS has ridiculous headbang potential especially when they play it live and pause like 30 seconds before the last verse
Degan Nestrichal,i see there is a difference
Elijah Parker,Literally half a second
Elijah Parker,Oh wait never mind just over a second
Degan Nestrichal,damn if J was there he woulda helped him get below 1 second
Elijah Parker,Hardly even have time to say I'm.
Elijah Parker,okay so are we having a super bowl party then?
Samuel Adams,I'm probably gonna be home for the super bowl
Samuel Adams,You boys should plan something though that would be epic
Degan Nestrichal,fuck no!!! I can't look like I'm not knowledgeable in football for a few hours!! It would ruin my reputation as a sub-119 IQ citizen of the Great American Youth!
Samuel Adams,Holy shit! Tom Brady is the greatest lineman that has ever played handball!
Degan Nestrichal,sam which flag is this
Degan Nestrichal,its for an assignment
Elijah Parker,Zimbabwe I think?
Degan Nestrichal,no
Samuel Adams,Nah it's an Arabic country
Elijah Parker,Fuck
Samuel Adams,I believe it's Jordan?
Samuel Adams,"Actually, it's Palestine"
Samuel Adams,Israel would tell you that's not a real country =^)
Degan Nestrichal,that would make sense its from a scifi film where the middle east deadlock results in the entire middle east being split up by elevator floors
Samuel Adams,Sounds interesting actually
Samuel Adams,What film is this
Degan Nestrichal,just a short film on vimeo
Elijah Parker,On that note I fuckin love this entire album of Scar's.
Elijah Parker,Angry British man.
Degan Nestrichal,my fav rapper is Lil Oedi
Elijah Parker,Is that an actual rapper?
Degan Nestrichal,yea
Samuel Adams,"Yeah, he does a lot of music videos with his mom"
Samuel Adams,Kinda weird owo
Elijah Parker,Lmfao fuck you sam token did one music video with his mom
Elijah Parker,He was like 16 at the time too
Degan Nestrichal,lil oedi legit had his mom grinding on his cock in 1 vid
Elijah Parker,Oh wait deadass yikes.
Elijah Parker,Eddie link ur fave song of his.
Samuel Adams,His shit was taken off of Spotify a year or so ago
Samuel Adams,"Because of his song ""I'm A Real Motherfucker"" where he claims to, indeed, be a real fucker of mothers"
Degan Nestrichal,i still got one music video
Degan Nestrichal,1 sec eli
Degan Nestrichal,gotta fin dit
Elijah Parker,Jesus christ this sounds too fucked to be true.
Degan Nestrichal,he straight killed it on this cypher
Elijah Parker,I fucking hate you so much.
Elijah Parker,That was a decent flow too so you got me drawn in too you absolute bastard.
Degan Nestrichal,lmao im weezing
Degan Nestrichal,that was the perfect transition
Elijah Parker,I fucking hate you.
Samuel Adams,In other news I haven't paid attention to Poppy in years
Samuel Adams,I don't know what she's become but I'm here for it
Elijah Parker,I'm not clicking that link mate
Degan Nestrichal,trust no one
Samuel Adams,"It's like a mix of deathcore, pop, nu metal, and Queen-esque classic rock"
Samuel Adams,How the fuck
Degan Nestrichal,eli it could have been worse it could have been cavity to cavity
Degan Nestrichal,heres the actual vid if u trust that
Degan Nestrichal,that fucking transition has me wheezing still lmao
Elijah Parker,I thought that looked a lot like denzel
Elijah Parker,I thought I was just racist for a second.
Degan Nestrichal,well eli now u have something to send to ur worst enemies
Elijah Parker,I'm not saving that lmfao
Degan Nestrichal,it will have the rap thumbnail so it would be discrete
Elijah Parker,Fuckin lil Uzi vert is ass bro idk how that dude is so popular. You'd think if you were going on a cypher you'd actually have something to say or planned at all ahead.
Elijah Parker,"Half the words he said were ""yeah"""
Degan Nestrichal,is everyone just a giant or is lil uzi vert lil
Elijah Parker,He's like 5'3 I think.
Elijah Parker,"Fuck one off. 5'4"""
Degan Nestrichal,21's verse pretty good and i dont even like rap
Samuel Adams,A proper English gentleman
Samuel Adams,I've always loved Denzel Curry that mf go hard
Degan Nestrichal,I sent my lass to the market because we ran out of pop
Samuel Adams,He did a cover of bulls on parade
Degan Nestrichal,i saw that
Elijah Parker,Denzel is pretty sick yeah.
Degan Nestrichal,You sent an attachment.
Elijah Parker,Idk if I can trust that.
Elijah Parker,Especially since it's reddit.
Degan Nestrichal,its top post on instantkarma
Elijah Parker,Alright it's fine then.
Elijah Parker,Lmfao fuck.
J Cole Patt,Jesus christ seeing drama unfold is fucking hilarious.
J Cole Patt,Watching this dude cheat and talk shit abt his girl just to cry to her later.
J Cole Patt,And she forgives and the cycle repeats.
J Cole Patt,This is fucking amazing.
Degan Nestrichal,wut u talking bout
J Cole Patt,This dude and her mans
J Cole Patt,Girl and her mans
J Cole Patt,Facebook drama.
Elijah Parker,What
Austin Medina,Nah im serious anyone wanna chill nd watch bupersowl
Degan Nestrichal,where @
Austin Medina,Anywhere idc lmao
J Cole Patt,when is it?
J Cole Patt,o fuck
J Cole Patt,litterally rn
J Cole Patt,wait nvm
J Cole Patt,its the 7th
Samuel Adams,It's Sunday at 5:30
Austin Medina,Lets all sneaky sneak into sams dorm
J Cole Patt,thatd be fun
J Cole Patt,we could tag team a couple hoes
J Cole Patt,1.6 percent of the us is fully vaccinated
J Cole Patt,Perhaps we shall get rid of the virus soon
Austin Medina,Man i love my civic i just gotta get better at driving it lmao
Austin Medina,Eventually i want a real race car tho
J Cole Patt,rip
Austin Medina,Tf
Austin Medina,That looks painful
J Cole Patt,its a tatoo
Austin Medina,Sam should i buy a na miata and turbo it
Austin Medina,O shit no way
Samuel Adams,Of course
J Cole Patt,"Sam, should I join isis?"
Austin Medina,kinda wanna buy an evo after seeing my friend tylers
Austin Medina,theyre siqq as fuqq
Degan Nestrichal,this is my fav crossover
Samuel Adams,Holy shit
Samuel Adams,Who knew Tekashi and Creed Fisher had so much to relate on?!
Degan Nestrichal,im still reviewing different technologies to see what to do for armory
Degan Nestrichal,"itd prob be most effective as a desktop application firstly, as the startup costs for storage space especially as the project expands could be difficult"
J Cole Patt,armory
J Cole Patt,As in
J Cole Patt,War shit
Degan Nestrichal,audio repository maximizing original recording yield
J Cole Patt,I have no clue what thaf is
J Cole Patt,But hit me up if u want like
J Cole Patt,Shit abt wae ig idk
Degan Nestrichal,ok ill make sure to hit u up for shit abt wae
Samuel Adams,We're creating a platform where you can basically constantly update a song as you go and the old version of the song is retained for future reference and so on
J Cole Patt,"Like, a app?"
Samuel Adams,So that old recordings aren't useless and you can still consult them for something cool you might've done before that should make the final cut
Samuel Adams,Hence maximizing recording yield
J Cole Patt,thats p neat
J Cole Patt,bruh this bit cut on my arm aint healing
Degan Nestrichal,lol rip u
J Cole Patt,Big*
J Cole Patt,Fkn
J Cole Patt,Ye
J Cole Patt,It aint bleeding tho so im gucci
J Cole Patt,"Wait shit, this isnt self harm"
J Cole Patt,"This is just a cut i have received, i do not mean in that way"
J Cole Patt,Kek
J Cole Patt,Nah man but on a different topic
J Cole Patt,Old recordings are def good in the terms of old shit isnt bad
J Cole Patt,Wouldnt you just need to set it up so you can like
J Cole Patt,Just trim and add it into the video?
J Cole Patt,And it just saves the old?
Samuel Adams,It's a little more complicated than that
Samuel Adams,You know how we have a video on the MR facebook page of us attempting six different takes or so of seven nation army
Degan Nestrichal,its similar to git's version control system is what im thinking but with song structure
J Cole Patt,Im certain it id.
J Cole Patt,is.
Degan Nestrichal,"so instead of no structure with git its like chorus, bridge, verse #, etc."
Samuel Adams,There was something unique about every single take that could merit further evaluation but the normal way to do these things is just to discard the old takes and consistently try to improve it every time without realizing the good things that each take had
J Cole Patt,"yoyoyo niggas, hop in tge gay"
Samuel Adams,"The end goal, I presume, is to create some kind of smart software that can detect differences in song structure and alert the user to them but that is well beyond the scope of any of our abilities atm"
Degan Nestrichal,yeah..
J Cole Patt,shit what
J Cole Patt,That sounds
Samuel Adams,I only know it's possible because Shazam can detect songs
J Cole Patt,Very difficult.
Degan Nestrichal,that reminds me when i was talking to my sisters the other day and they legit have no idea how massive some of the projects they are describing to me are
Samuel Adams,And I doubt Shazam is open-source
Degan Nestrichal,they were like you should make a google maps but for truckers :o
J Cole Patt,"Yeah in terms of coding, it sounds very difficult."
J Cole Patt,Lmao
J Cole Patt,Map the entire planet eddie
Samuel Adams,"Exactly, so the first iterations of this project are going to be very user-input oriented"
J Cole Patt,And write code for it.
Elijah Parker,"Night, guys."
Degan Nestrichal,@ eli
Elijah Parker,I actually did end up staying later than I wanted to yeah.
Elijah Parker,But I did so cleaning at least. :):)
Elijah Parker,But now it's really schleep time.
Degan Nestrichal,fuck this guy is gonna kick my ass if i ever burn his flag!
Elijah Parker,lmao Eddie u look so sleepy in the corner.
Samuel Adams,When Drake tried to claim racism didn't exist
Elijah Parker,Of course Drake tried to claim it wasn't real bro he's white!
J Cole Patt,Rip
Elijah Parker,"""I've never gotten cancer, therefore cancer doesn't exist"""
Elijah Parker,That's literally the same mentality.
Samuel Adams,"Well if you can't find a source of racism, chances are 1. you're blind to it and/or 2. you're the source of it"
Samuel Adams,In this case Drake was both
Elijah Parker,I mean that's fair too.
Elijah Parker,"That or you're one of those dudes that's completely racist but try to hide it behind offensive ""jokes"" and claim that's all it is is a joke."
Elijah Parker,Lmao good fuck this dude.
J Cole Patt,"Listen man, ill admot, words can be racism, but using them doesnt neccessarily make you racist."
J Cole Patt,While its definitly certain that people are getting soft snd such words shouldnt be used in public. But if your in a private setting you should always have free speech.
Samuel Adams,It's not so much that I care what Drake says as much as he's being hypocritical by trying to claim that racism doesn't exist because he's never seen it
J Cole Patt,Because hes white.
J Cole Patt,And has money
Elijah Parker,But to say it doesn't exist while saying words specifically meant to keep a different race down he's also a fuckin idiot.
J Cole Patt,Shit drake got police on his side with shit.
Elijah Parker,No he doesn't.
Elijah Parker,Drake's FAMILY does.
Samuel Adams,Yknow it's been over a year since we've mingled with Drake
Samuel Adams,"The whole ""I'm gonna call the fucking cops on you Eddie"" thing happened January of 2020"
Elijah Parker,Wait what
Elijah Parker,Lmfao he said he was gonna call the cops on eddo?
J Cole Patt,P sure the police contacted eddie as well
Samuel Adams,They did lmao
Elijah Parker,Oh wait yeah.
J Cole Patt,Im down for harrasing drake again.
Samuel Adams,I think I can pull up the voicemail too
Elijah Parker,For the shit he posted on reddit lmao.
J Cole Patt,Make it a yearly thing lmao
Elijah Parker,Bro.
Elijah Parker,I wanna hear this voicemail lmfao.
Elijah Parker,We should ask him if he's moved on from using black slurs to Asian slurs or something.
Elijah Parker,"""what's up Drake you call anyone a gook lately?"""
Elijah Parker,Sam you got the voicemail though? 👀
Elijah Parker,👀👀👀
J Cole Patt,universoty police
J Cole Patt,MR drake fox
Elijah Parker,Drake seems like the type of dude to say people are getting soft until someone insults him.
Elijah Parker,Then he literally calls the cops pfft
Samuel Adams,No that's quite literally the dynamic
Samuel Adams,He was fine with talking about other people but then when people return the favor he gets fuckin tilted
Elijah Parker,"""Ugh I know I just told this family they were nothing more than scum I wipe off my boots but they didn't need to call me a tiny fairy faggot :(:("""
Elijah Parker,Eminem???
Samuel Adams,Holy shit it's Hailey Mathers
J Cole Patt,Feminem
Elijah Parker,He really does make a convincing girl though what the fuck.
Elijah Parker,me.
Elijah Parker,baguette
J Cole Patt,.357 sig looks so
J Cole Patt,Weird
Elijah Parker,what a qt 3.14
Samuel Adams,Mfw I have to walk through more snow to get to class
Samuel Adams,I took this pic remember
Samuel Adams,Mandela effect
Degan Nestrichal,"god im such a manly man chad, none of you guys could even compare"
Austin Medina,i just bought a impact wrench poggies
Austin Medina,an * lmao
Degan Nestrichal,what do that do
Austin Medina,uses air to remove bolts and stuff
Austin Medina,like lug nuts in a more time efficient manner
Degan Nestrichal,god bless black men <3
Degan Nestrichal,@Austin Medina oh so it can be used to change a tire with tight nuts right?
J Cole Patt,eddie do u still got some of that hack daniels.
J Cole Patt,I need to chug it
Degan Nestrichal,ya
Degan Nestrichal,lol just turn 21 so u can be a full-time alcoholic
Degan Nestrichal,dats what eli planning to do
Elijah Parker,8 more months for me and sammy.
Elijah Parker,Nah I'll probably be in job Corps by that time.
Degan Nestrichal,18 more months for me
J Cole Patt,its 2 many
Elijah Parker,Is booze really that good to you?
Degan Nestrichal,life on booze > life sober
J Cole Patt,Nah imma go into a weed coma
Elijah Parker,I mean fuck fair enough. I'd rather be stoned personally.
Degan Nestrichal,lol u guys are weedaholics
Elijah Parker,Yeah.
Degan Nestrichal,@ eli
J Cole Patt,Man ive been to too many drug deals recently that you see alot of stupid shit.
J Cole Patt,The pay b shit as well.
Elijah Parker,I can't sleep mate I'm taking a bath and reading Journey to the West.
Degan Nestrichal,is that about manifest destiny
J Cole Patt,What
Elijah Parker,Not really. It's a Chinese novel from back in the 16th century about a group traveling to india to obtain sacred Buddhist tomes.
Degan Nestrichal,the imperialist idea that God mandates the colonization of the west
J Cole Patt,"""ye, im raiding ur shit cuz god told me to lol"""
Elijah Parker,all of the crusades.
Degan Nestrichal,i see
Austin Medina,basically what i need the tool for is so that i can remove tires quickly lmao
Austin Medina,and also rebolt them quickly
Degan Nestrichal,i learned that my gay scifi literature class is basically ignoring that HP lovecraft ever existed because he was a white supremacist and blah blah
J Cole Patt,Racist exist
Degan Nestrichal,god liberals are so gay
Elijah Parker,It's actually pretty decent. Idk if you've ever heard of a character called Sun Wukong or The Monkey King but this is a story with him.
J Cole Patt,Racist look like this
Elijah Parker,He's something of a folk hero in China.
Austin Medina,"cuz a big part of my job will be doing tire rotations which is where u remove the wheels and rotate them to different axle depending on the drive train, this is done to even out the wear on the tires and make them last longer"
Austin Medina,also i gotta inspect stuff like brakes and such so sometimes you need to take off the wheels
Elijah Parker,Also that's fucking stupid HP Lovecraft was the GOAT and inspired pretty god only knows how much modern science fiction.
Austin Medina,but at the same time idk if my boss is actually gonna make this shit happen or not this is the second time he's mentioned me moving up and not shit has happened
Austin Medina,so we will see
J Cole Patt,Biggest racist of us all
Elijah Parker,The racism boss.
Elijah Parker,Level 999999
Austin Medina,i wanna open my own shop pog
J Cole Patt,However
Austin Medina,but idk shit
J Cole Patt,One step below that racist
Elijah Parker,Will call the cops on you if u hurt his feelings :(
J Cole Patt,Is this man
Elijah Parker,Fuck u
Austin Medina,where am i on the racism scale
J Cole Patt,Lmao
Elijah Parker,Fuck I guess I am racist to some degree. I fucking hate white people.
J Cole Patt,Im suprised you know about the local gang that runs our neigborhood but you domt knoe how casually racist they are.
J Cole Patt,"U wanna be more racist, join them."
Austin Medina,we have gang activity?
Austin Medina,idk shit i just wanna work and make cool cars
J Cole Patt,Yeah
J Cole Patt,The hicks
Elijah Parker,Your racism levels are rising.
Austin Medina,the hicks LMAO
J Cole Patt,P sure we talked abt this when u were over.
J Cole Patt,Yeah man they legit sell weed all over here.
J Cole Patt,Theres a couple minor dealers tho
Austin Medina,i may have been drunk but i kind of remember also
Elijah Parker,Hey Niko.
Austin Medina,we should get drunk and watch superbowl
J Cole Patt,Shit well talk abt it later maybe.
Elijah Parker,Let's go bowling :):)
Degan Nestrichal,o shit we could
Austin Medina,it would be good time yes no?
J Cole Patt,I am technically off.
J Cole Patt,I just gotta get lilly out of here if we drinking.
Degan Nestrichal,fuck ye lets get drunk and watch superbowl at J'
Elijah Parker,I wanna come :(:(
Austin Medina,im down but i gotta get up and go to work in the morning lmao
Degan Nestrichal,even tho austin is the only one that knows anything about foosball
Austin Medina,its fun to watch just for the commercials
J Cole Patt,Man i dont even like football all that much tbh
J Cole Patt,Who is playing?
Elijah Parker,A bunch of people who make too much money.
J Cole Patt,Tbh
Degan Nestrichal,chiefs
Degan Nestrichal,then some rando team i forget
Elijah Parker,Buccs
Elijah Parker,I think?
Austin Medina,tampa bay buccs they have tom brady
Austin Medina,swag
J Cole Patt,they both garbo
Samuel Adams,Tom Brady's BUCC
Austin Medina,dude sam heard football and came RUNNIN boy
Elijah Parker,Knucc if u bucc
Samuel Adams,What team do you like J
Austin Medina,gimme the chiefs
Elijah Parker,Sam are u coming to the superbowl party?
J Cole Patt,"none, but since i was born in IL, the bears."
Degan Nestrichal,shit i remember now that Sam said yesterday that we can raid his place on sunday and that his facebook account was hacked so we should not listen to anything it says otherwise
J Cole Patt,They garbo tho
Samuel Adams,I mean I gotta be back at school Sunday night weather permitting
Austin Medina,LMAO
J Cole Patt,fucj this is tomorroe?
Samuel Adams,Because I have a 9 am on mondays
Degan Nestrichal,nah sunday
Samuel Adams,Actually fuck it I could skip it
J Cole Patt,Yall mean tomorrow
Elijah Parker,👀
J Cole Patt,I thought it was the 5th
Degan Nestrichal,lmao les go
Austin Medina,no its sunday
J Cole Patt,Fuck something is happening tomorrow and i forgot what it was.
Elijah Parker,It's the 4th.
Austin Medina,the superbowl is on the 7th
Austin Medina,just to clear that up
Austin Medina,lmao
Elijah Parker,Yeah it's the 4th today lmao.
Degan Nestrichal,i have no classes on monday so im gud
Austin Medina,if the other guy at work wasnt already taking vacation time until next thursday i would skip work
Elijah Parker,Also take vacation time.
Elijah Parker,👀
Austin Medina,nah i like money
Elijah Parker,You get paid for vacation days non?
Austin Medina,idk yet ive only been there for like 3 months
Degan Nestrichal,nah its not a white collar job eli tf
Elijah Parker,I know at goodwill I got paid for vacation days
Degan Nestrichal,o shit goodwill
J Cole Patt,nah austin doesnt get paid at all
J Cole Patt,0$ hr
Austin Medina,eddie you should buy a jeep srt8 when you get big boy programmer money
J Cole Patt,He does get free gram of cocaine once a week tho
Elijah Parker,I just assumed every place paid for vacation days lmao.
Austin Medina,i dont think i have any tho i know they pay for vacation days
Elijah Parker,Yeah that's true.
Elijah Parker,Alright austin we can't have you get too drunk then.
Austin Medina,im not even gonna bother i cant leave the one guy by himself there hes becoming more and more of a lil bitch
Austin Medina,ill just get wasted and show up to work 6 hours late
Elijah Parker,That's the right idea.
Elijah Parker,Lmfao
Degan Nestrichal,so where this b happening at
Austin Medina,swag on these hoes with a racejeep
Degan Nestrichal,i just want a modest ol'reliable austin
Austin Medina,thats reliable its a jeep but its also like a shit ton of power
Elijah Parker,I mean my place is the least restricted but I don't have cable in my room lmao.
Austin Medina,ah shit
Austin Medina,yeah i guess j's place would be the best but sam already said we can get shitfaced in his basement and play rock and roll all night long
Degan Nestrichal,oh thats right
Degan Nestrichal,i forgot
J Cole Patt,That sounds better
Elijah Parker,They also said we can fuck hookers down there don't forget.
Austin Medina,im gonna smoke some crack in his basement
Degan Nestrichal,"awesome @Samuel Adams basement, get trashed, destroy the guitars, and completely trash the basement!"
Austin Medina,ok fug i gotta go to bed
Austin Medina,"i am become degen, destroyer of basements"
Austin Medina,message u tmrw guys gn
Elijah Parker,Gm
Elijah Parker,FUCK
Elijah Parker,Gn.
Elijah Parker,Same though it's schleep time.
Degan Nestrichal,wasup eli how long u staying up for? you trying to staying up all night?
Elijah Parker,Probably not. I'm just reading a few more pages in a journey to the west and then I'm schleepin
Degan Nestrichal,good stuff
Elijah Parker,It's actually like. Intriguing lmao. Most old books seem to drag on and on but this is good. I like this.
Degan Nestrichal,join teh gay if u want to discuss strategy for how to trash sams basement and ruin his life
Elijah Parker,I'm not in the discord.
Degan Nestrichal,were u kicked
Elijah Parker,Maybe? Idk I was drunk one night and when I woke up I wasn't in there anymore.
J Cole Patt,He isnt
J Cole Patt,I couldve sworn he was
Elijah Parker,I told you.
Degan Nestrichal,contact JJ altho he is prob too busy doing a karl marx cum tribute atm
Degan Nestrichal,@JJ Joseph
Degan Nestrichal,sam what are ur thoughts on madison nixing lovecraft from the scifi genre because he was a white supremacist
Degan Nestrichal,*scifi curriculum u get it tho
Samuel Adams,One can separate the art from the artist
Samuel Adams,"Charles Manson had some cool songs, Phil Spector produced some of the most influential records ever, doesn't mean they were good people"
Degan Nestrichal,its just to the point where its practically misinformation by censorship
Samuel Adams,"And it's worth evaluating his horror because his racism came from the same place, it's a way to understand people and that he was frightened of other races which led to his hatred"
Degan Nestrichal,the way she describes him in lecture is just as a vehement white supremacist
Samuel Adams,"That is misinformed, because even so there's a lot to be learned from Lovecraft's works"
Samuel Adams,But shit I don't need to tell you this lol
Samuel Adams,We can't pander to people forever
Samuel Adams,Someday there's going to be some heinous event in American history that can't be brushed aside as mere black-or-white morality and what are these people gonna do
Degan Nestrichal,idk most of the text ive read from lovecraft hasnt had any blatant white supremacy. Maybe a lack of inclusion but it was the 1920's
Samuel Adams,Nah he had a poem called the origin of nwords or something like that and it's blatantly racist
Degan Nestrichal,oh ik im just saying most of his popular texts // the ones relating to the cthulhu mythos
Samuel Adams,But we can read it through the lens of “Racism and horror can be correlated because they both stem from some kind of fear” which doesn't trivialize who he was but rather takes what is useful
Degan Nestrichal,"ya know i have heard of that correlation between his depiction of foreigners or a different culture and his beliefs, but i feel like its just speculative, which is all literature studies tbh"
Degan Nestrichal,if you just take his stories at face value they are definitive horror fiction
Degan Nestrichal,hop on teh gay if knowledgeable about niggas in paris
Samuel Adams,I have to fucking SHOVEL god FUCK
Austin Medina,Ive been working outside all day cuz this dumb bitch that i work with called in like the wop he is
Austin Medina,So yeah im all alone at work today trying to do everything im about to call his ass out cuz he shouldve and couldve been here
