name,message
Samuel Adams,Eddie what did you think of that monstrous fucking RIFF
J Cole Patt,lmao
Samuel Adams,"That is a mineral, because it is heavy as fuck"
J Cole Patt,Just sum concrete or something
Samuel Adams,It is pure rock
J Cole Patt,=D
Elijah Parker,Jewish laddie
Degan Nestrichal,this is me after JJ blows up my entire base in minecraft and is hellbent on destroying me
Degan Nestrichal,as i sit here and ponder on whether or not i have been a good ally to JJ on the GAY minecraft server
Degan Nestrichal,also fk i have a project due at 4pm and i havent slept y do i keep doing this
Austin Medina,Austin be like: oh fuck bro i have an oil change due at noon
J Cole Patt,"I would like to propose a peace treaty and Alliance.
I have built a courtroom and have gifts and such for everyone. we will settle hostilities."
Samuel Adams,Da moon
Samuel Adams,We will destroy da moon in our quest for dominance
Elijah Parker,Nah sam we need to create a self sufficient community on da moon and blow up Venus.
Elijah Parker,You silly goose.
Elijah Parker,Bobby Shmurda got released from prison like 2 days ago.
Elijah Parker,To pull back like. Shit that happened in middle school.
Samuel Adams,When you get your restraining order in the mail
Elijah Parker,That's an old pic holy fuck.
Elijah Parker,"February 23rd, 2017"
Samuel Adams,2017 was yesterday let's be real
Elijah Parker,With how long 2020 was it was a fuckin decade and a half and you know it.
Austin Medina,Lol all my superiors are having a meeting so im just supposed to manage the garage with me and this one lady
Austin Medina,That guitar tone is so rich man
Elijah Parker,"Lmao imagine referring to them as your superiors and not just ""the assholes who pay me"""
Austin Medina,"They dont pay me, the owner does"
Austin Medina,Theyre my superiors
Elijah Parker,Exactly.
Austin Medina,They are a bunch of dumb assholes tho
Samuel Adams,The breakdown riff about a minute in is pure headbanger material
Samuel Adams,We gotta make a song out of this
Elijah Parker,But nah don't say superiors austino.
Elijah Parker,Say the snakes.
Elijah Parker,Or back stabbers bro.
Elijah Parker,Or. Even Supervisors.
Austin Medina,Theyre not even snakes lmao they just suck at their respective jobs particularly the service director
Austin Medina,Theres no gameplan at all on a day to day basis
Elijah Parker,Calling them your superiors makes you sound like someone who just lets people walk over them though laddie.
Austin Medina,I dont take no shit but they are my superiors in the truest sense because their job rank and responsibilities are higher than mine
Elijah Parker,Nah laddie it's not the definition so much as the principle.
Elijah Parker,Imagine if Kamila Harris started calling herself an inferior to Joe Biden.
Samuel Adams,In a legitimate sense she is
Samuel Adams,Kamala can't use the nukes unless Joe is incapacitated
Elijah Parker,Yes but again.
Elijah Parker,It's not the definition so much as the way it sounds.
Samuel Adams,"There's gonna be power dynamics no matter where you go, no matter what kind of society you live in, that's just how people operate most efficiently"
Samuel Adams,Every team has a leader so to speak
Elijah Parker,Like I would never fuckin call myself an inferior to someone.
Elijah Parker,Yeah true.
Elijah Parker,But that's not like. They're superior to me.
Elijah Parker,They just got that role.
Samuel Adams,"I suppose so, but by merit of having that role they have the ability to make choices and influence people in a way someone else can't"
Elijah Parker,I won't call myself the inferior to anyone because I'm my own person that could even be better at the job than they are.
Elijah Parker,That's true I suppose. Agree to disagree then. Personally it's just the sound of the words inferior and superior and how those are usually used in sentences.
Austin Medina,I hate this fucking job lmfao
J Cole Patt,"im suprised to hear that, but otherwise sad to hear that"
Austin Medina,Gamestop is back on the rise
Austin Medina,That shit was stupid how was i alone supposed to handle anyone that couldve come through the door
Austin Medina,I shouldve just shut the doors down and turned off the lights
Samuel Adams,So nice to be a college student where I can recreate the guitar tone from Them Bones in the relative comfort of my dorm room!
Austin Medina,So sunday or saturday to chill??
J Cole Patt,i wpuldmt mind
Austin Medina,Just waiting on sam because he has his sisters bday
Degan Nestrichal,they are superior to u they make more money than u eli that means they are objectively better at life xD
Austin Medina,Okay are we hanging out this weekend or not because I need to do a lot of work on my car is going to need to know which day works for everybody
Austin Medina,So i need to know what days work*
Degan Nestrichal,stop asking me as if im the one who decides dis ask sam
Degan Nestrichal,god austi
Degan Nestrichal,n
Austin Medina,Niggas aint responding smfh well maybe u got some shit going on too idek smfh
Degan Nestrichal,niggas is sam
J Cole Patt,sam reply to dms
Austin Medina,I swear I think some of these people are purchasing their licenses online
Austin Medina,Some  retard in a Honda minivan tried to pass me
Austin Medina,Even though the road was already done merging he still tried to pass me
Samuel Adams,Sunday would work my boys
Samuel Adams,Since my sister's birthday is saturday
Austin Medina,Okay cool
Degan Nestrichal,oh so we are not invited to her birthday party? thats fked
Austin Medina,I got an oil leak on my Honda that I'm going to fix on Saturday
Degan Nestrichal,austin we should show up hammered to sams sisters birthday party
Samuel Adams,There's no birthday party kek we're probably just going to a restaurant or something
Degan Nestrichal,ah so shes gotten to that age now
Austin Medina,Let's just go to whatever restaurant Sam's family goes to and will get absolutely smashed
Degan Nestrichal,ill be camping outside austin ill let u know where they go
Degan Nestrichal,fk we shoulda made our world in biomes o plenty
Samuel Adams,Get back to work you fucking NEET! GOD!
Austin Medina,I fucking love this car
Austin Medina,Eventually ill daily it so idk how travel arrangements will work when we chill cuz the backseat is tiny
Austin Medina,Maybe sam can drive and ill sit in back 😤
J Cole Patt,Lmao
J Cole Patt,Id like to keep a positive image in his parents head
J Cole Patt,Just so theyd let sam have more leeway
Austin Medina,Meh sam can just sneak from milwaukee anyway
Austin Medina,Although it would be nice to raid his basement
J Cole Patt,Just the basement?
J Cole Patt,The whole house niqqa lets go
Samuel Adams,There ain't much else to do in my house tbh
Austin Medina,His basement is cool as fuck j
Samuel Adams,All the fun stuff is in the basement kek
Austin Medina,We can jam properly there
Austin Medina,Sams basement is the most based in the groupchat
Samuel Adams,J's grandpa's being an honorable mention
Samuel Adams,But alas we cannot jam there for many eons I feel
Degan Nestrichal,sam is the only one with a basement so he kinda win automatically
Samuel Adams,In some ways not having a basement is better than having to really fix up a horrible one
Samuel Adams,"It took a lot of time, effort, and money to get my basement to where it is now lmao"
Samuel Adams,"It was worth it tho, definitely boosted the fuckin property value on the house"
Austin Medina,And we never get to use it :[
Samuel Adams,You're tellin me bruv
Samuel Adams,"But like I said things are looking up because if my dad's case goes well and it looks it is, my mom won't be so anal about having people come over and seeing how terrible the house is! Oh no!"
Samuel Adams,Cuz we'll have money to fix up some shit
Samuel Adams,Covid is another thing but it didn't seem to matter in June when Austin came over lol
Austin Medina,Lol does ur mom think im gonna come in and be like :// uhhh why is the sink draining properly and the floor is slightly dusty
Samuel Adams,Alright boys I'm goin out to dinner I'll be back later
Austin Medina,Did i come over in june tf
Samuel Adams,Go look on my Instagram fool
Degan Nestrichal,omg austin is gonna roast sams family on the spot
Samuel Adams,We jammed ain't so pretty and heartbreaker
Austin Medina,Oh ye right roight bru
Austin Medina,I saw my first lamborghini today
Austin Medina,Lol
Samuel Adams,"Hey bro, nice cock! Where'd you get it?"
Elijah Parker,Thanks bro! It's been with me all my life!
Elijah Parker,It's like a family heirloom bro!
J Cole Patt,Imagine that
J Cole Patt,You pass ur dick onto ur son and stuff
J Cole Patt,"""this cock has pleased many women son, including your mother, and mow Im giving it to you."""
Elijah Parker,"I mean not your dick. But you technically do ""inherent"" it to some degree."
Samuel Adams,"This cock belonged to my 17th great grandfather, the Earl of Cornwall. It is said he possessed the girthiest hog in all the British Empire, and I'm sure it would warm his heart to know that you now possess it."
Elijah Parker,It's all fossilized and shit.
Elijah Parker,Looks like a fuckin drinking horn the Vikings used to drink out of.
Austin Medina,"Its weird to think my family was once over in europe mainly, i even found out the mexican side had ancestors that came to mexico from spain centuries ago"
Elijah Parker,I don't know too much about my family before the Great depression.
Samuel Adams,"Chronologically speaking, white people in America is a relatively new thing lmao"
Austin Medina,Yeah in the grand scheme of things
Austin Medina,"If the shit i found is actually correct, portions of my family have been in the us since before its inception"
Austin Medina,Others more recently came from mexico and germany
Elijah Parker,I know that my great grandfather came over around 1930 from Ireland. I also know that his last name was O'herlihy. I don't know a ton of details about it but I know that.
Elijah Parker,My grandma told me a little about him and then a lot more about my family onwards.
Austin Medina,"Thats really cool bruh, i have irish ancestors too i didnt reliaze how many irish folks i was related to"
J Cole Patt,Join the IRA
J Cole Patt,I wouldnt be too opposed to fighting the british.
Austin Medina,"Lol idk, theyre just my ancestors i dont think any of them would care about the ongoings of current europe"
Austin Medina,They were americans
Samuel Adams,I used to have a well-developed ancestry thing going somewhere but I don't know where it is now
Elijah Parker,Hi
Elijah Parker,Xbox b down
Austin Medina,What yalldoin
Elijah Parker,Waiting for London. We've gotta go shopping.
Elijah Parker,By the way.
Elijah Parker,Eddie and J next time I see you guys I've got you.
Austin Medina,Hey sam
Austin Medina,We got a chance to play a show bruh theres a biergarten that opens in the summer by the lakefront and they have live music
Austin Medina,We could probably play it if we wanted to
Elijah Parker,@Samuel Adams
Samuel Adams,Fuck yeah
Austin Medina,"theres a legit chance we could, a lot of performers last year were one man acts with backing tracks lmao"
Austin Medina,@Samuel Adams
Samuel Adams,I enjoy this very much
Samuel Adams,I was soloing over this snippet and it sounds pretty cash
Austin Medina,i gotta work on that shit a bit more
Austin Medina,but basically it is dmaj7 to gmin with some embellishments in between and then towards the end i went gmin > b5 > c#5
Austin Medina,i would say yeah either gmin pentatonic or just make up some riffs around that chord progression
Austin Medina,sounds pretty good
Austin Medina,now we have it on file we can write some stuff with it next time we jam
Samuel Adams,Did you ever tune your guitar back up to standard
Austin Medina,yeah kek
Austin Medina,like right when i got back from mke i think
Austin Medina,"ive been playing quite a bit, mainly been practicing that bach partita in dminor"
Austin Medina,that shit is fucking insane bro it takes a lot of focus to play at the correct tempo
Austin Medina,i got a little bit of it memorized but theres some parts that involve a lot of string skipping and sweeping motions
Austin Medina,"but not sweep picking, the notes are all individually plucked"
Samuel Adams,I am going to school in the Arctic Circle
Elijah Parker,Soon I will be as well
Samuel Adams,It is broad daylight at midnight
Elijah Parker,Damn bro your whole ass town is in hell rn nigga
Samuel Adams,It is the purest form of purgatory
Degan Nestrichal,man this low level programming class is difficult
Degan Nestrichal,i thought low level meant for retards xD
Degan Nestrichal,i might not be able to hangout this sunday because school is really catching up to me but i might say fug it like austin idk yet
Austin Medina,Nah bruh gotta get that diploma fug drinking and scaring off the white pussy we can do that next weekend
Degan Nestrichal,lol wym austin u literally almost had sex with both of those girls!
Degan Nestrichal,but fug bro i have no motivation for learning about C's abstract memory diagram rn gotta drink to make myself more inteligant
J Cole Patt,We gotta do the plan
Degan Nestrichal,"CS is fucking hard dude, software carpentry is much nicer and chill"
Degan Nestrichal,must drop out and make new google maps app for truck drivers
Austin Medina,Smh okay i cant talk you out of it bro guess we can be degens this weekenx
Degan Nestrichal,alcohol makes u more intelligent
Degan Nestrichal,thats how i fixed my website while drunk then also proceeded to mess it up by accidently entering 1 character where i shouldnt have
Austin Medina,This is objectively true any data presented to try to convince me otherwise will be disregarded as jewish propaganda
Degan Nestrichal,"if u guys want to im down, i gotta get some social interaction bro or else ill end up in existentialist dread like sam! no one deserves to think like sam austin!"
Austin Medina,Sam is just simply too smort
Degan Nestrichal,J u should totally buy the keyboard from me
Degan Nestrichal,its a razer huntsman retail is like 90 its barely used
Degan Nestrichal,for u only 50 :ooo
Degan Nestrichal,it glows in the dark :o
Degan Nestrichal,like the CIA n
J Cole Patt,Send a pic?
Degan Nestrichal,its clicky
Degan Nestrichal,dont feel like setting it up on razer synapse rn but u can customize the lighting nicely
Samuel Adams,You know lads it's a little more short notice but we could probably hang today instead if that works better
Austin Medina,Gotta help my mom file her taxes but ill see if i can get out of it
Samuel Adams,Sunday is pushing it for me as well since I gotta get back for in person shit on Monday
Degan Nestrichal,lmao just tell her to not file them tf
Austin Medina,Okay i dont get off till 5 doe tonight so just letting u all know
Degan Nestrichal,today will only work if i can get all my work done fast
J Cole Patt,I can as well. Where is it that we are hanging?
J Cole Patt,If its my place then it works a bit more well than usual since im tired af
J Cole Patt,But only after 5pm cuz my mother is working and she worjs at home.
Austin Medina,"Okay im down with that, that works for me fasho"
Austin Medina,Edward can you pick up semual
Degan Nestrichal,i have to sprint to get my work done but i most likely can?
Degan Nestrichal,ill just concentrate rn ill cya guys in 4-5 hrs
Austin Medina,Kk ily
J Cole Patt,He didnt say it back
J Cole Patt,How does it feel to be unloved austin?
Austin Medina,Idk
J Cole Patt,You must not know because ily <3
J Cole Patt,Sam whatre u doing
Samuel Adams,I am fucking CHILLING
Samuel Adams,Might work on some guitar related fuckeries
J Cole Patt,want me to come pick you up?
J Cole Patt,Actually scratch that i got a thing to do.
Austin Medina,Sam bring your acoustic
Austin Medina,No cappers
Samuel Adams,My 4 string acoustic which still hasn't been fixed right
Samuel Adams,I mean shit I could I've written some songs specifically with the 4 strings lmao
Austin Medina,"Ah shit i can maybe bring one of mine to write on, im not bringing an amp tho"
Samuel Adams,Here's an example of a song I wrote in DGDG tuning
Austin Medina,Ok bro i am gonna chill with u guys tn
Samuel Adams,And then this is DADF# tuning
Austin Medina,Sounds decent tbh
Austin Medina,Im bringing my civic since its insured now
Samuel Adams,Ebic
Samuel Adams,Serves Me Right has been in the catalogue since September and it's one of my favorite songs that I've written
Samuel Adams,"Simple, but the lyrics stand out to me"
Samuel Adams,Lmao fug should I bring my acoustic I've actually written a lot of songs with the 4 string tunings
Austin Medina,"Ill bring one of my electrics but no amp, too much noise"
Austin Medina,Are we drinking cuz i gotta work tmrw at 7 which means i gotta leave by 6:30
Samuel Adams,I actually have no idea kek
J Cole Patt,I dont mind if we drini
Austin Medina,Fug yeah
Austin Medina,Ill be down im just not tryna get shitfaced again
J Cole Patt,xP
Degan Nestrichal,would we be able to crash at J's or no
J Cole Patt,"You woupd be able to yes, but wait till 5pm"
J Cole Patt,i can get more of a confirmation on it.
Degan Nestrichal,ye ik
J Cole Patt,"Ie, ask my mother."
Degan Nestrichal,ok cuz otherwise we'd prob have to wait til i sober up
J Cole Patt,P sure shed be cool with it tho.
Degan Nestrichal,@Samuel Adams ill prob be there by 5:15ish
Degan Nestrichal,jeez whats wrong with u stop clicking on notifications so fast!
Samuel Adams,I already had messenger open kek
Degan Nestrichal,whats our plan for food btw? j?
J Cole Patt,invest ur caps in the stock market
J Cole Patt,pizza for food
J Cole Patt,le romas
J Cole Patt,i got us a 12 pack of code red as well.
Degan Nestrichal,@Samuel Adams am here
Austin Medina,Im omw imma go grab my civic
J Cole Patt,ah ye
J Cole Patt,my mom said it was all gucci
Austin Medina,Im here niggus
Austin Medina,Are yall here or nah eddie
J Cole Patt,come on in
J Cole Patt,Unit 8
J Cole Patt,left building
J Cole Patt,2nd one down
Samuel Adams,We're almost there
Samuel Adams,Two Of A Kind started a video chat.
Samuel Adams,Two Of A Kind joined the video chat.
J Cole Patt,"Goodbye, My Darling! joined the video chat."
Myjuanron Taylor,Human Thing joined the video chat.
Samuel Adams,The video chat ended.
J Cole Patt,if yall get pizza rolls from dollar general we got a air fryer
Elijah Parker,Ay
Elijah Parker,Eddie
Elijah Parker,I need help.
Elijah Parker,I'm looking for a laptop and I'm in best buy
Elijah Parker,Which one of these is better and would be able to download shit like steam. Chromebooks won't do that.
Degan Nestrichal,chromeos is trash
Degan Nestrichal,get ssd + at least 8gb ram
Elijah Parker,Fuck
Elijah Parker,Eddo
Elijah Parker,This is just for rn. Which one though?
Samuel Adams,You might as well save up for a better laptop
Degan Nestrichal,"honestly they are both very low end machines, you're better off saving u cant play minecraft with either well"
Elijah Parker,I didn't get one.
J Cole Patt,god im so fucking drunk eli pls send a picture of ur genitalia
J Cole Patt,this is eddie btw
Elijah Parker,I'm with London rn
J Cole Patt,send a sex tape
Elijah Parker,I now own a ukulele :):)
Elijah Parker,a pineapple ukulele.
J Cole Patt,How much ram?
J Cole Patt,Think it could run minecraft?
Elijah Parker,Yeah probably.
J Cole Patt,Ye u might need to add ram to it
J Cole Patt,yhe modpack b a little beefy
Degan Nestrichal,omao nigga can run minecraft at 2fps with that dogshit
Degan Nestrichal,@Elijah Parker PMAO 128KB id barely anything go guck urself
Elijah Parker,Nah but I agree I should just wait to get an actual worth while one.
Degan Nestrichal,@Elijah Parker 128KB is NOT ALOT THE ENTIRY MEMORY SPACE in the C programming language is 4GB!!
Degan Nestrichal,GB are MORe TUAN KB
Elijah Parker,So I got a ukulele at Music Go Round for 40 bucks.
Degan Nestrichal,GB MoRe than mb which is more than kb which is more than Bytes which is more than bits which is more than individual complementary metal oxide semiconductor transistors
Elijah Parker,I see I see.
Elijah Parker,Austin what do you think of my pineapple ukulele lad?
Degan Nestrichal,Terybytes is more than that and petibyted is more thsj thsr
Degan Nestrichal,"austin just told
me it looks like shit"
Elijah Parker,Aw :(:(
Elijah Parker,I like it a lot actually.
Degan Nestrichal,he said u shoulda gotten more RAM and more CPUs
Elijah Parker,:(:(:(
Degan Nestrichal,also he said that ukele plauers arent real
Elijah Parker,What about you sammy? What do you think of my yellow and pineapple ukulele.
Elijah Parker,It's a boi
Samuel Adams,Looks cool
Samuel Adams,Play us a song
Elijah Parker,London is having a conversation in the background sorry
Samuel Adams,Fuck yeah
Elijah Parker,It's a soprano ukulele apparently.
Elijah Parker,I'd love to learn an actual song on it. I've been just kinda strumming it. That sounds nice by itself even I can't wait until I learn a coherent song.
Elijah Parker,I got a new shower curtain :):)
Samuel Adams,Fuck
Degan Nestrichal,eli did u nestrichal ur gf last night
Degan Nestrichal,uhh @Samuel Adams
Degan Nestrichal,u forgot ur instrument
Samuel Adams,Oh fuck lmao
Samuel Adams,"Don't worry about it I gotta go to the store later, I can drop by later to pick it up"
Degan Nestrichal,i could just swing on by in 10 mins im not home yet
Samuel Adams,"Whatever's easier for you, I appreciate it"
Samuel Adams,Fuck! I accidentally reacted to Eddie's message! Now he thinks I love him! 😔
Austin Medina,We gotta get this dude sam a car bro
J Cole Patt,"Ha, gay!"
Samuel Adams,Oh fuck Austin you accidentally shifted into reverse on a bridge with no railings! Uh oh!
Degan Nestrichal,@Samuel Adams here
Degan Nestrichal,some fkin idiot switched lanes without looking onto me
Degan Nestrichal,god sam u need to get a car to feel my frustration
J Cole Patt,What
J Cole Patt,The
J Cole Patt,Fucj
Degan Nestrichal,austin b like dont judge bro
Austin Medina,What in the god damn fuck
Degan Nestrichal,love dont judge
Degan Nestrichal,oh shit sam went 150 on the highway and is back in milwaukee
Elijah Parker,I b strummin boys
Elijah Parker,Hey sam the guitar just got here.
J Cole Patt,geetar
Samuel Adams,Send pics
J Cole Patt,Im suprised austin got high with us
Samuel Adams,That was a good time
J Cole Patt,And Eddie felt it as well
J Cole Patt,These brownies must be made right
Austin Medina,i was pretty fucked that was a weird high
J Cole Patt,Ye it b fuckey with tge alchohol.
J Cole Patt,But fun otherwise
J Cole Patt,last night was needed 4 me.
J Cole Patt,Enjoyed tf outta myseld
J Cole Patt,kitchen clean af rn tho
Samuel Adams,"That's why I opted to not drink as much, I hadn't felt high and not crossfaded in a while"
Elijah Parker,I'll send pics when London and I get back from Milwaukee.
Samuel Adams,What are y'all doing in Milwaukee
Austin Medina,LOOL
Austin Medina,man i love the sound of my honda i just wish it was faster
Austin Medina,one day i will have real racecar
Elijah Parker,We were just kinda exploring. We went to a half price books.
Samuel Adams,Epic
Elijah Parker,Sammy.
Elijah Parker,When would you be able to swing by tomorrow?
Elijah Parker,London wants to help but she's gotta leave by like 8 tomorrow.
Austin Medina,@Samuel Adams
Samuel Adams,What in the sam hell
Samuel Adams,That sounds ridiculous
Austin Medina,I gotta make it cleaner
Degan Nestrichal,Anyone wanna try promethazine with me?
J Cole Patt,ismt that a antihistamine?
J Cole Patt,or do u mean potmethazine
J Cole Patt,the thc syrup
Austin Medina,nigga eddie gonna become a codeine feind
Austin Medina,fiend *
Elijah Parker,👀
Degan Nestrichal,"promethazine in the baby bottle, meditating on daily dollars"
Degan Nestrichal,j cole said this! ^^^
Degan Nestrichal,austin bro u gotta get a PC
J Cole Patt,lmao
Austin Medina,Im saving up for a house
Austin Medina,Man what a good weekend
Austin Medina,"That shit felt like it was an eternity lmao, cant believe i took that edible and still made it to work early"
Samuel Adams,Austinian is high
Degan Nestrichal,fuck yeah! creed fisher!
Degan Nestrichal,You changed the group photo.
Degan Nestrichal,You changed the group photo.
Degan Nestrichal,You changed the group photo.
Degan Nestrichal,You changed the group photo.
Austin Medina,i love that
Austin Medina,saving it for my personal collection
Samuel Adams,You need to add the dude who has the come take it flag lmao
Samuel Adams,"And the ""BACK THE FUCK UP I AM NOT WEARING A MASK"" guy"
Degan Nestrichal,if u guys want our guns so bad.... then.. then.. erm. uhr.. come and take them!!
Degan Nestrichal,You sent an attachment.
Degan Nestrichal,virtue signalers b like
Austin Medina,I fuckin hate virtue signaling negres
Degan Nestrichal,ik y cant every1 be an ironic racist like austin
Samuel Adams,Just signed my lease
Samuel Adams,Signed my fucking life away! Yeah!
Degan Nestrichal,fuck what am i gonna do next semester
Degan Nestrichal,they are planning on in person
Degan Nestrichal,austininian lets get an apartment
Degan Nestrichal,for august
Degan Nestrichal,austin this is ur calling!!
Austin Medina,Im down eddie
Austin Medina,Ill have to get a job lined up first
Austin Medina,So wait sam youre gonna be in an apartment next semester?
Samuel Adams,Yes
Samuel Adams,It'll come out of my financial aid so it's not quite representative of me being independent yet but it's still p cool
Samuel Adams,The plus side is they don't really enforce covid regulations in the apartments
Samuel Adams,So even if this shit is happening next year we can get crunk
Austin Medina,Fuck yeah next year is gonna be amazing
Austin Medina,I think when i go to buy a house i wanna move to a small town within commuting distance to one of the major cities in wisco
Degan Nestrichal,doing codeine in the laundromat bathroom with a 20 cent hooker poggers
Austin Medina,Lmao nigga
Austin Medina,Prussian empire imminent?
Samuel Adams,Who you playing as
J Cole Patt,oh god no he plays vic 2
Austin Medina,Prussia kek
