name,message
J Cole Patt,Using such swear words are important
J Cole Patt,"Today i will either make money, or be in jail."
J Cole Patt,We shall see how this will go down boys =^)
Elijah Parker,lol
Elijah Parker,London spent the night. I woke up and there she was.
J Cole Patt,What a suprise
J Cole Patt,That means she likes you
Elijah Parker,Yes.
J Cole Patt,Gotta hate it when u sleep at their house and they end up missing.
J Cole Patt,Thats something that sucks.
J Cole Patt,Is this how the party went?
Samuel Adams,Yes
Elijah Parker,Yeah that's accurate.
Samuel Adams,Eli do I even have to ask if you fuked
Elijah Parker,Non. She's still here and currently shirtless so.
Austin Medina,did she lose it? fuck im worried for her 😔
J Cole Patt,XD
Austin Medina,eli u gotta help her find it
J Cole Patt,where was i sam
J Cole Patt,Pov your my steering wheel and im going 120 on the gighway stoned
J Cole Patt,goodbye austin
Degan Nestrichal,fk what does austin want now
Degan Nestrichal,he wont leave my house
J Cole Patt,If i have fucj ton of illegal money im gonna spend it on mcdonalds ice cream
J Cole Patt,Like
J Cole Patt,"You dknt understand, the irs doesnt yet keep track of how much ice cream you eat"
J Cole Patt,eventually when thet do this
J Cole Patt,We will be truely detained.
J Cole Patt,my goal is to eliminate the government.
J Cole Patt,Im just trying to add random shit thatll pop up in eddies website.
Samuel Adams,👁👄👁
Samuel Adams,"24 hours later, we are alive babes"
Austin Medina,Yep and I'm nearly home so I'm alive 2
Samuel Adams,Fuck yeah
Austin Medina,All right boys pay up $20 each for the blowies
Elijah Parker,what
Austin Medina,Lmao sam and eddie owe me money for gas and food
Elijah Parker,she schleep
Degan Nestrichal,come and take it austin
Degan Nestrichal,o btw eli can u gimme 10 whenever we hangout next for the pizza?
Elijah Parker,Yeah I gotchu.
Degan Nestrichal,i need more paper money so i can wrap it around my dick
Elijah Parker,Although I'll be honest with me not working it'll probably be in quarters bro.
Degan Nestrichal,fk
J Cole Patt,rip
J Cole Patt,You can work for me if you need money Eli.
Degan Nestrichal,austin still here he says i owe him $5000 and wont leave my family alone
Elijah Parker,I'm good J. I don't want to find any kind of employment while job Corps can hit me up at any time and ask me to come to campus.
J Cole Patt,no gay?
Degan Nestrichal,gay and limp dick but there is no nice acronym for it :(
Elijah Parker,"Linguini, Duck, Nigiri and Scotch"
Elijah Parker,💛
J Cole Patt,We only the Great American Youth
J Cole Patt,Not the Liberal Dick Niggers from Scotland
Samuel Adams,Something like that
Elijah Parker,Oof
Degan Nestrichal,eli yesterday
Elijah Parker,Accurate.
Elijah Parker,I suddenly learned Japanese from the nutt as well.
Degan Nestrichal,eli final form is multilingual
Elijah Parker,My final form has invented a new language bro.
Elijah Parker,No but unironically the screaming with the Japanese made me think that was a leaked scarlxrd song lmao.
Elijah Parker,@Myjuanron Taylor
Elijah Parker,Hey man
Elijah Parker,How are you? It's been a while.
Myjuanron Taylor,"Yes, it has"
Myjuanron Taylor,How've you been
Elijah Parker,I've been doing pretty great honestly. I got accepted into Job Corps and now I've got a lass and :):):):):) How about you man?
Myjuanron Taylor,"Ayy that's good, it's been a little rough, and I'm still unemployed but that's that"
Elijah Parker,Have you checked out job corps lad? They'll train you for a trade totally free of cost.
Myjuanron Taylor,"I've applied to Jewels, probs gonna apply to Dollar gen in a bit"
Elijah Parker,Good shit bro. I'm glad you're not letting it get you down at least homie.
Myjuanron Taylor,"Can't let it, gotta just push past it"
Elijah Parker,Shit true but I mean I'm glad either way you aren't. It's good to see you're not letting it fuck with you homie 💛
Myjuanron Taylor,Thanks man
Elijah Parker,Of course bro. Good luck with Jewels and DG as well 💛💛💛
Degan Nestrichal,lol i tried giving 4 gigs of RAM to the minecraft java process on my 4 GB ram cloud machine
Elijah Parker,What happened bro
Degan Nestrichal,"well it basically took like 10 minutes for me to type ""killall"" to stop the server"
Degan Nestrichal,gonna use 3 gigs now
Degan Nestrichal,i was using 2 gigs last night and it ran decently
Degan Nestrichal,eli bro get a PC bro
Elijah Parker,I have to get cash first mate.
Degan Nestrichal,i need a 64x64 image for de server
Austin Medina,Who is the new homie in the chat
Elijah Parker,Mo.
Austin Medina,Ah shit i would not have assumed that from the name lmao
Elijah Parker,Mo's been here for like forever lol
Austin Medina,I didnt even know shit
Samuel Adams,Use this one Eddie
Elijah Parker,LMFAO
Degan Nestrichal,i doubt it will look good scaled down to 64x64
Degan Nestrichal,but i will tri
Austin Medina,Man fug were supposed to get more snow
Austin Medina,Like 4-9 inches
Elijah Parker,God said fuck the whole Midwest.
Austin Medina,I might redownload minecraft
Samuel Adams,We're getting off to a stellar start on GAY
Elijah Parker,Sammy do you happen to have a cigar box around your house?
Samuel Adams,Unfortunately not
Elijah Parker,Fuk
Samuel Adams,I'm gonna do some research and once I get some extra cash from Marquette I might even order some shit for this project
Elijah Parker,Ah mate it's not gonna need a whole bunch.
Samuel Adams,I'm aware but the beauty of a cigar box guitar is getting a lot out of a few components
Samuel Adams,It's probably in our best interest to have backup shit because I imagine it'll be easy to fuck up lol
Samuel Adams,Holy fuck! Redpilled MC server!
Degan Nestrichal,rebecca is trembling at how to out redpill us as we speak!
Degan Nestrichal,cigar box guitar?
Samuel Adams,Basically we build our own guitar out of stuff you can generally find lying around
Degan Nestrichal,that reminds of this one video i saw of this madison student making a guitar out of nothing
Samuel Adams,"If the first one is cool and works out, we wanna make more"
Degan Nestrichal,who is we
Samuel Adams,Me and Eli
Degan Nestrichal,o i c
Samuel Adams,Best case scenario is I can record songs with it and it won't sound like shit xd
Degan Nestrichal,"thats interesting actually, im not a very good craftsman so it seems mountainous"
Elijah Parker,Me either but grandpa has been working with wood for over 40 years so if we get stuck I'm sure he wouldn't mind helping.
Austin Medina,I know how to work wood too
Austin Medina,;]
Degan Nestrichal,funny u say this at the same exact time
Samuel Adams,This is our foray into being luthiers boys
Austin Medina,Why dont we just start a youtube channel or all start streaming
Austin Medina,And make vlogs out of our degenerate fuckery or irl stream
Degan Nestrichal,because ur computer is on its dying breath!
Austin Medina,Thats inconsequential bro
Austin Medina,!!
Samuel Adams,Austin sell your laptop to Eli
Degan Nestrichal,lol once covid is over we can do funner shit
Austin Medina,Im excited for life to eventually get back to normal
Samuel Adams,Fuck man it can't come soon enough honestly lol
Austin Medina,Supposedly most americans should be fully vaxxed by end of july
Degan Nestrichal,is herd immunity like 90%
Samuel Adams,Apparently they pushed summerfest back to september again
Austin Medina,"Idek, but theres bound to be some folk that dont get vaccinated idek how thatll play out"
Samuel Adams,We gotta go see some shows boys if they don't fuckin cancel it
Austin Medina,Hell yeah bro
Samuel Adams,Ultimate end-goal is to play shows of course owo
Austin Medina,Ill keep practicing
Elijah Parker,I'll be the guy with a cigar box guitar.
Elijah Parker,Or perhaps.
Elijah Parker,a BASS
Samuel Adams,Acoustic basses are kinda lackluster imo
Samuel Adams,Almost like bass is meant to be an electric instrument
Elijah Parker,Thanks for remembering I don't want to make the cigar box guitar electric bb 💛💛💛
Elijah Parker,In other news.
Elijah Parker,It's fucking cold.
Samuel Adams,"Personally I think an acoustic electric would be fantastic, you can play it unplugged and then if it's got a pickup you can plug it in and probably get some nice ass tones from it"
Elijah Parker,I was out on a walk to get some schmonk and cuddled this stray cat I know. Poor baby was shivering like a mf with his short coat havin ass. I slipped him under my coat and cuddled him for a few minutes so he could warm up. I really wish I could have a cat. I call him Mr. Meowstache because he's a tuxedo with a pattern above his mouth that looks spot on like the monopoly man's moustache.
Elijah Parker,Eh I'd probably make the first one just acoustic. I like acoustic better personally. Although with how cheap it'll be to make we can make numerous sammy.
Elijah Parker,We could make a cigar box banjo and create a bluegrass band too sammy boy
Elijah Parker,My lock screen is now London and I. It will be a different picture in a bit but the same category. We're gonna hang out again 💛💛💛
Samuel Adams,Excellent
Samuel Adams,"I'm looking into the engineering behind these things, thankfully we can get most of the wood we need from Lowe's or whatever"
Elijah Parker,Grandpa has a shit load of wood downstairs bro
Elijah Parker,He makes bows and such with it.
Samuel Adams,"The most important things are going to be proper intonation and fret spacing, once we actually build a structurally sound piece"
Elijah Parker,That's where it'll be up to you and me.
Elijah Parker,And that's also where the youtube videos come in lmfao
Elijah Parker,Like he'll do some of that I imagine but that'll be a whole new ball game for him
Samuel Adams,That's why I'm watching a lot of videos on this particular part of it lol
Elijah Parker,When I asked him about it he told me he's never built a guitar actually.
Elijah Parker,Do you also have strings I can use?
Samuel Adams,"Buying strings won't be an issue, we can probably just use general guitar strings on this thing"
Samuel Adams,"My idea is to string it up basically like a normal guitar but with 4 strings, EADG"
Elijah Parker,What's EADG?
Elijah Parker,LMFAO
Elijah Parker,never mind bro I've been skoking
Samuel Adams,Those are the corresponding notes for each string generally
Elijah Parker,smoking***
Austin Medina,I just had the most mind-numbing conversation with that chick at work
Elijah Parker,Do those sound good for like the blues and jazz as well as they do for rock though?
Austin Medina,She tried to convince me that Jews are white
Samuel Adams,"However I like to tune my 4 string acoustic to open tunings and I've written quite a few songs with these, like DADGb or DGDG"
J Cole Patt,eddie ate dynamite!
J Cole Patt,good bye eddie!!
Samuel Adams,One thing I should mention is that we don't have to think about genre when we're building this thing
Samuel Adams,"It'll sound perfectly fine for whatever you play on it, intervals don't change, but instrument timbre does"
Elijah Parker,Alright cool. I'm just personally like. way more interested in learning those genres yk?
Elijah Parker,I've been watching tutorials but without something to practice on it just feels like a waste of time rn
Samuel Adams,Tutorials on how to build the instrument or how to play it? Kek
J Cole Patt,Shit the biggest tbing i hate about learning a instrument is not wanting to play cause of lack of practice.
Elijah Parker,Play it lol
Elijah Parker,I suppose I should start watching the building ones first though eh?
Samuel Adams,"Honestly I don't know, I'm coming at this with a decent background in music so I understand the theory and some of the engineering like using harmonics to find where to put the frets"
Samuel Adams,But I think for our purposes we should focus on building the highest quality instrument possible first and then when it's functional we can think about learning how to play it
Austin Medina,We're about to get so much fuking snow I hate this state
Austin Medina,Also what the hell Vincent Jackson died
Austin Medina,Sem u know who that is or nah
Samuel Adams,Old WR for the Bucs
Austin Medina,Yeah he was a beast
Austin Medina,Im willing to bet drugs sadly i mean he was a 38 yr old former pro athlete
Austin Medina,And he had been missing for like 4 days
Austin Medina,i found a bunch of my ancestors using ancestry im surprised this works so well
Degan Nestrichal,u found out that ur related to robert e lee?
Austin Medina,nah bruh so far my ancestors are all yankees from the east coast that immigrated from ireland and england
J Cole Patt,did they make u cum in a vial?
Austin Medina,no lmao thats for the genetics or some shit
Austin Medina,im just looking through census and birth/death certificates
J Cole Patt,rip
Austin Medina,and using other peoples trees that may be my distant relatives
Austin Medina,ive also got some canadians in the mix
Degan Nestrichal,"i heard there are homosexuals that volunteer as vials there austin bro thats nutty, i mean good for u man"
Degan Nestrichal,how mexican r u
Degan Nestrichal,more escobar or chapo
Austin Medina,i gotta do the mexican side next im focusing on the euro side rn
Austin Medina,tryna see if any of my relatives were actually german
J Cole Patt,U got the last name medin
J Cole Patt,Medina
Austin Medina,ok
Austin Medina,and
Austin Medina,according to the site a lot of my ancestors have been in mainland USA since before the USA's conception
Elijah Parker,It's ya lad
Elijah Parker,Currently at carthage lads
Elijah Parker,Feelin totally fuckin outta place lmao
Samuel Adams,Dude what are you majoring in
Degan Nestrichal,"bro eli u gotta come to the tailgate on saturday, all the white girls are gonna be drunk and flash their tits!"
J Cole Patt,Remember to be aware of rapists
Degan Nestrichal,yo eli make sure u find a girl named giana
Degan Nestrichal,snuff her out
Austin Medina,found my great grandfathers draft card from ww2
Austin Medina,thats actually pretty fuckin cool
Elijah Parker,Non
Elijah Parker,Dude I'm majoring in puss slamming bro! I already got invited to a frat party bro!
Samuel Adams,Did you really
Austin Medina,so what im hearing is were all going to a frat party
Samuel Adams,My thought exactly lmao
Samuel Adams,Sneak us in
J Cole Patt,That stuffs fun
Samuel Adams,Oh god oh fuck! We're gonna run into Chris and Lewis!
Degan Nestrichal,we are prob gonna see some BBW riding lewis's cock!
Degan Nestrichal,these are the secret tricks the Wisconsin DMV doesn't want you to know to pass your drivers test!
Austin Medina,these are so fucking funny
Austin Medina,"my 16th great grandfather on my grandmothers side is 
Sir Nicholas 10th Baron Latimer of Braybrooke Griffin"
Austin Medina,which means something
Austin Medina,okay i found one of the german ancestors
Austin Medina,they lived on a farm in wadsworth once they immigrated bro i am part of the fabric of this community
Degan Nestrichal,imagine having to go back tens of generations to find anything cultured! XD! first gen mexican niggas be like
Austin Medina,im proud of my heritage
Austin Medina,the mexican side so far is folks from nuevo leon
Austin Medina,some of which came from from spain in maybe like 1600s
Degan Nestrichal,austin u gonna learn some spanish
Austin Medina,Si mi amiga
Austin Medina,amigo
Austin Medina,FUCK
Degan Nestrichal,as long as u can get the accent down and
Degan Nestrichal,a decent amount of spanish
Degan Nestrichal,ur basically in
Austin Medina,nice
Degan Nestrichal,gotta get the accent down tho or else u sound like a gringo
Austin Medina,imma keep working out tho i think bro shit is dank asfuck
Austin Medina,makes u feel like a god damn chad
Degan Nestrichal,shit austin gonna exceed me in weight with pure muscle mass
Degan Nestrichal,i need to workout too but i prefer to run and its the fkin worst time of the year
Austin Medina,just start lifting bro you can be a bear
Austin Medina,im gonna be a turbo manlet who is shredded but u can be a beast
Samuel Adams,We could all get shredded
Austin Medina,nothing stopping u
Degan Nestrichal,alright austin ill be at ur house tmrw at 4AM make sure to leave the door unlocked and hope tim doesnt tackle me!
Austin Medina,lol i actually may get up at 4 am to make sure i get to work on time
Degan Nestrichal,oh dats right snow emergency
Austin Medina,lmao
Austin Medina,tomorrows gonna be hell
Degan Nestrichal,oh no now i have to dig my car out from 20 inches of snow rather than 12!
Samuel Adams,Bet you the Forenza will still start two weeks from now
Austin Medina,big doubt for me on that one
Degan Nestrichal,id be sorta surprised
Degan Nestrichal,its been a bit over 2 weeks now
Austin Medina,"its not getting any charge atm, if you just drive it around every once in a while that will help"
Degan Nestrichal,austin bro u owe me 2 hookers if ur wrong
Austin Medina,trying to convince my mom to come home early from her part time job because of the storm but she said she cant just lock up and leave
Austin Medina,i was like yeah u can lol
Samuel Adams,Lmao hilariously enough I look up wadsworth and the first result is wadsworth ohio which is conveniently in medina county
Degan Nestrichal,temperatures should be getting better tho
Austin Medina,glitch in the matrix lmao
Austin Medina,so yeah officially my great grandfathers grandmother & grandfather on his moms side came from germany
Austin Medina,and settled in wadsworth and were farmers lets go
Degan Nestrichal,bet they bummed they missed out on the holocaust
Austin Medina,LMAO
Samuel Adams,Dude have you found any lost long siblings or cousins yet
Austin Medina,realistically i probably could but it would be weird lmao
Degan Nestrichal,my dads wifes girlfriend
Degan Nestrichal,its 2021 u bigots!
Degan Nestrichal,apparently its supposed to be satire but its a real situation..?
Degan Nestrichal,here is a good video outlining the different crypto wallets.
Degan Nestrichal,electrum and wasabi are closer to the original crypto philosophy of decentralization
Degan Nestrichal,"the channel is pretty dope, guy is a network engineer that teaches stuff about operations security and cryptography"
Samuel Adams,Eli is definitely blackout drunk right now
Degan Nestrichal,fk eli hijacked a moped and transcended to learn japanese
Samuel Adams,This seems like exactly the kind of shit drunk Eli would do if he learned Japanese
Samuel Adams,On his way to kill face tat guy
Samuel Adams,I can't figure out what I'm supposed to be asking Drake lmao
Degan Nestrichal,..why you cant make it and why he has to fill in for you
Degan Nestrichal,idk some1 filin for drake in da band maybe
Samuel Adams,I can't think of anyone who would be filling in for Drake around this time
Samuel Adams,Truth be told I didn't really keep in touch with any of the st joes drummers after we went our separate ways
Samuel Adams,I could probably still find timmy taco on campus and ask if he wants to jam xd
Samuel Adams,Just talked to Audino about snow drifting and was reminded that we could've nearly died on the mf highway on the way to Kenosha lmao
Degan Nestrichal,noooo then we woulda never hit it off with those grills 😔
Samuel Adams,"Fuck you're right! I would've never gotten shitfaced, only minorly tipsy!"
J Cole Patt,Barnum b a qt
Samuel Adams,God bless
J Cole Patt,sam
Austin Medina,Cant wait till all the atheistic satanists start teaching children
Degan Nestrichal,thats right austin if you are like every single guy and judge a girl on physical appearance u have shrimp dick energy!
JJ Joseph,"Fun fact this article is wrong transgender people have been competing with there new gender but not in all places. One major story they tend to use as evidence was when a ""trans women"" who look like a man beat all the girl wrestlers, well that person was actually a trans man. Trans men preform at a similar level as cis men. This also goes to transgender woman as well the statement is unfounded that trans women out preform cis women because almost everywhere they already don't let trans women play until there ""passing"" this means they have gone through hormone therapy. Also it's funny to mention Caitlyn jenner who stoped takeing hormone replacement when she got into her relationship with kris jenner in 1991"
JJ Joseph,They have been since the 90s
JJ Joseph,Probably before that too
Samuel Adams,I used my ult on that last bitch! She's now dead!
Samuel Adams,Dude no way I'm in a class with Caleb!
Degan Nestrichal,holy fuck caleb started using opiates thats crazy
Samuel Adams,"He left his webcam on and accidentally shot up on the call, what a silly guy xD"
Austin Medina,"Human no. 98,560,437,861 has entered the chat"
Samuel Adams,Those 5 flights of stairs in straz got me feelin ruff
Samuel Adams,I really need to do some fuckin cardio
Austin Medina,Summer is coming time to get fit
Samuel Adams,Omg I love Reydiohed! Best band ever!
Elijah Parker,hi sam
Samuel Adams,How fucked did you get at that party bruv
Elijah Parker,Oh I was joking lmao.
Samuel Adams,Damnit! Another opportunity to drink into a stupor denied!
Elijah Parker,I did see a few frat lookin dudes get in a fight in the snow last night so that was funny.
Samuel Adams,How was your time with le London
Elijah Parker,Slippin and sliding all over the place but still trying to look tough the whole time lmfao.
Elijah Parker,I'm still here actually. We're about to be taking off p soon but she's doing an assignment right now
Samuel Adams,Pog
Elijah Parker,There's a ton of people who go to campus here.
J Cole Patt,The security guards there are dicks
Samuel Adams,What's the policy ther
Samuel Adams,Are they allowing outsiders into the buildings or nah?
Elijah Parker,Northern Ireland is not Britain lad ask any North Irishman and they'll slap you for even thinking it.
Samuel Adams,@JJ Joseph
Elijah Parker,Nah she snuck me in. No overnight visitors.
Samuel Adams,"I figured as much, that's the policy here too except no visitors at all"
Elijah Parker,I had to pee last night so she gave me some of her carthage merch to blend in and keep.
Samuel Adams,The perks of living in a dorm with an en suite bathroom in every room
Samuel Adams,Does she have roommates who had to be ushered away for your antics lmao
Elijah Parker,Nah thankfully. She's like the only chick on this floor without one.
J Cole Patt,kek
Samuel Adams,London's gotta bring over more chicks next time we all get together so I can get shitfaced in front of all of them
J Cole Patt,"""i want to see sam get drunk af, cmon london let me watch!"""
Samuel Adams,@Austin Medina Started watching some scotty kilmer videos what a chad
Samuel Adams,This man's making me want to track down a 20 year old tahoe just because they're brick shithouses
Austin Medina,Das scheißhaus
Austin Medina,Scotty kilmer is kinda wack but hes funny
Samuel Adams,Big toyota fanboy from the looks of it
Austin Medina,"I was considering getting a lexus bro lmao, i found some nice ones theyre basically just luxury toyotas"
Samuel Adams,Why do I want to get a pickup trick what the fuck am I gonna use it for lol
Samuel Adams,Something just appeals to me about the extra utility idk
Austin Medina,"Dont gotta use it for anything but i mean, find a reason"
Austin Medina,Get into kayaking or some shit
Samuel Adams,Roll down the block in my 4x4 ford ranger
Austin Medina,Ford rangers are very legit first cars bro
Austin Medina,No cap
Austin Medina,I was considering getting one but i want a comfy car eventually
Samuel Adams,Austin what site do you mostly use for car shopping
Austin Medina,Cars.com and facebook marketplace
Samuel Adams,How the fuck does this thing only have 33k miles lmao
Samuel Adams,This man drove his car 2 miles a day
Austin Medina,You can look up features you want like heated seats
Samuel Adams,If this winter has taught me anything it's that I'd like a 4x4 car as long as I live where it can drop a foot of snow overnight lmao
Austin Medina,4x4 is good for getting unstuck and stuff but you still gotta leave a lot of stopping space
Samuel Adams,"Honestly once I get a good bit familiar with the Escape, I'll probably understand moreso what to really look for in a car"
Austin Medina,"Just get something with decent heat, awd or 4x4, decent sound system, you should be good with that for a starter car fasho brotha"
Samuel Adams,Yee
Samuel Adams,"This escape has 91k miles on it, I'd consider fixing some of the stuff on it like the front right speaker that's semi-blown out but I should probably look to get rid of it within the first year or two"
Samuel Adams,It's probably not worth much more than 2k sadly
Austin Medina,What year is it
Samuel Adams,2008
Austin Medina,"Nah thats worth more im willing to bet, just fix it up and clean it real good when you go to sell"
Austin Medina,Ill do work on it if u want bro i gotta practice 😳 cheap ass oil changes for all my friends
Samuel Adams,My only worry is the repairs will cost more than I can get for it lol
Samuel Adams,"Both bumpers are damaged a little and the right rear tail light is basically colored duct tape, and I dunno where to start with redoing the speakers since if I gotta replace one I might as well do them all"
Austin Medina,"Depends man, if its big work it could be, but brakes, suspension, stuff like that is usually worth doing"
Austin Medina,Youtube it
Austin Medina,I kinda wanna come check it out and see if anything is wrong from what i can tell
Samuel Adams,There's also some sort of leak somewhere which trips a code but my dad has a doohickey that clears the check engine light and it's certainly not anything that makes it undrivable or unsafe
Austin Medina,Probably exhaust or evap or some shit
Austin Medina,I wanna get a tattoo bruh
Austin Medina,Gonna get a tat of Arminius on my bicep
Elijah Parker,Artimus?
Austin Medina,No
Austin Medina,Arminius
J Cole Patt,I can get u a real nice tattoo artist.
Austin Medina,He was an ancient german hero and chieftain
