name,message
Elijah Parker,Pretty good. I liked it.
Samuel Adams,What kinda music do they play?
Degan Nestrichal,fk the one time where i have an assignment on communism in literature JJ isnt online!
Degan Nestrichal,erm sam
Degan Nestrichal,is communism the one that calls for teh abolishing of labor
Samuel Adams,No that'd be a utopian ideal
Samuel Adams,"Communism is from each according to his ability, to each according to his need"
Samuel Adams,"You still work, but it's not wage labor, it's what you want to do, what you can contribute to society"
Samuel Adams,"Now a communist utopia is a classless, moneyless society, but that's a different thing altogether"
Degan Nestrichal,"‘Robots throughout the world, we command you to kill all mankind. Spare no man. Spare no woman. Save factories, railways, machinery, mines and raw materials. Destroy the rest. Then return to work. Work must not be stopped.'"
Degan Nestrichal,how can i draw technophilia from this?
Samuel Adams,"An emphasis on robots being ""better"" creations and therefore getting rid of humanity"
Samuel Adams,"The technophiliac part of it is just preferring machines to humans, this is just an extreme example"
Degan Nestrichal,"i see, i see"
Degan Nestrichal,hope my TA isnt some gommie that is gonna tear apart everything i say about gommunism and silence me!
Degan Nestrichal,"i remember when i followed with bisexual communist and when of soulsticeisabsent's normie friends commented ""MOTHER RUSSIA""!"
Degan Nestrichal,how cringe!
Samuel Adams,Ew! Little do they realize that Russia is now a fascist oligarchy!
Samuel Adams,I'm still in soul's graveyard
Samuel Adams,What am I doing here
Degan Nestrichal,omg go off queen 🥵
Degan Nestrichal,yas we stan killing all men! 🥰😀😁
Degan Nestrichal,if anyone knew how to speak in tongues it would be the pope
Elijah Parker,hi
Samuel Adams,Eli be boofing!
Elijah Parker,I am p high though too lmao
Samuel Adams,Where is Eli going
Elijah Parker,I don't know
Samuel Adams,Excellent
Elijah Parker,Probably culver's
Samuel Adams,Don't get murdered
Elijah Parker,We just went to goodwill and got me hella clothes.
Degan Nestrichal,eli what are the prices on used bathtubs looking like nowadays over at goodwill? might cop..
Elijah Parker,bro there was a drop in the used bathtub market bro. Record prices bro.
Samuel Adams,Buy the dip!
Degan Nestrichal,bro no way bro! hold on im getting the rope to tie it to my car roof!
Degan Nestrichal,"ive been getting into kidney mining recently, purchased 4 3090s"
Samuel Adams,Noooooo! I can't possibly do this!
Elijah Parker,Is not possible.
Degan Nestrichal,it pays off it makes $7 a day - $9 in electricity
Degan Nestrichal,in a year you will be down $730! 😎
Degan Nestrichal,jk crypto prices are volatile
Degan Nestrichal,i wonder if theres some dude in a dorm with a beefy crypto mining setup just profiting off of not paying electricity
Samuel Adams,Unfortunately I can't do this next year because electricity is the one utility not covered lmao
Elijah Parker,Get a solar panel
Elijah Parker,lol
Elijah Parker,slap it onto the side of markwet they'll love it.
Elijah Parker,London and I are at red Robin.
Elijah Parker,I went to goodwill today.
Austin Medina,niggas fight on the hill
J Cole Patt,I have no car now
J Cole Patt,Rip
J Cole Patt,"On other news, saint paddies day was great!"
J Cole Patt,🇮🇪
Samuel Adams,What happened
Samuel Adams,Did the volkswagen finally shit itself
J Cole Patt,Car bomb
Samuel Adams,Oh lmao
J Cole Patt,"My er, family has paid me a couple thousand for it and well"
J Cole Patt,A great price for a working engine.
J Cole Patt,"They gave it to some dude, its so nice of them =)"
Samuel Adams,How much did you get for it?
Samuel Adams,I'd wager that car was worth about 2k
J Cole Patt,10K
J Cole Patt,Cuz i gotta stay quiet
Samuel Adams,For fuck's sake
J Cole Patt,"My grandparents are fairly pissed at me for taking the deal, but theyll get over it."
Samuel Adams,Well you can get a MUCH nicer car for 10k
J Cole Patt,Exactly
J Cole Patt,"I am kidding however,"
J Cole Patt,"My father has borrowed the red car,\"
J Cole Patt,Rip
Samuel Adams,So what really happened
J Cole Patt,My dads car got fucked
J Cole Patt,Truck
J Cole Patt,its a pos and hes borrowing mine.
Samuel Adams,Didn't he just upgrade it too lmao
Samuel Adams,Thought I saw something about that on insta
J Cole Patt,Join VC
J Cole Patt,Much needs to be said
J Cole Patt,Also can you ban my dad.
J Cole Patt,"Use the reason ""a fair amount of degerenercy you cannot know about in here"""
Samuel Adams,@Austin Medina Andy Dalton to the Bears HAHAHAHAHAHAHAHAHA
Degan Nestrichal,2 factor authentication in ssh
Degan Nestrichal,wut
Degan Nestrichal,this is to the school computers :/
J Cole Patt,rip
J Cole Patt,@Samuel Adams
J Cole Patt,Get back to vc
Degan Nestrichal,@Samuel Adams get on VC please my life depends on it!
Degan Nestrichal,@Samuel Adams a thug is currently pointing a gun at my head and is threatening to shoot me if you don't join VC!
J Cole Patt,Sam i need a guitar reccomendation
J Cole Patt,I am going to buy a guitar and maybe a bass
J Cole Patt,=^)
J Cole Patt,What do the 4 knobs do
J Cole Patt,I Want something that says what they do
Samuel Adams,Volume and tone
J Cole Patt,Not my price range tbh
Samuel Adams,What are you looking to spend on a guitar
J Cole Patt,Okay how about a Bass?
J Cole Patt,Thats what I wanna dee
J Cole Patt,Unless my guitar has been shit this whole time.
Samuel Adams,"Your guitar is fine, I've played it and never had a problem"
J Cole Patt,Green??
Samuel Adams,This one is nice too
Samuel Adams,Maybe even better than the first
J Cole Patt,Whatmakes a guitar nice?
Samuel Adams,"This one has a bass booster built in, and it sounds pretty nice"
Samuel Adams,It's also red so you'll be matching with me and my BC Rich <3
J Cole Patt,This is good
J Cole Patt,Ill buy it with u when we go next
J Cole Patt,When u home
J Cole Patt,"better yet, this weekend actually"
Samuel Adams,"I'll be free saturday, I'm going to be busy on friday"
J Cole Patt,sweet
Samuel Adams,I go to ETTEUQRAM
Degan Nestrichal,whenever i get the time and can have more than 3 hrs of sleep im gonna try to rewrite the entire website in C
Degan Nestrichal,but for now im in this gay machine organization class where i have to write my own memory allocator as a project!
Degan Nestrichal,austin how does it be happening at ur stupid ass 9-5 that u could easily quit at any moment to make a million dollars in ur basement?
Degan Nestrichal,or how is ur day going
Austin Medina,"Good, currently on a daring mission to pick up noodles and co for my coworker in a loaner car that i lied to the office lady to obtain"
Austin Medina,They think im parking it somewhere else on the lot
Austin Medina,How u neegus been
Degan Nestrichal,ive gotten like no sleep all week but ill be good by the weekend
Austin Medina,Why no sleep
Degan Nestrichal,huge CS project + stats midterm + a ton of other scattered assignments throughout the week
Degan Nestrichal,madison is tuff
Austin Medina,That sucks balls
Austin Medina,Itll be worth it tho
Degan Nestrichal,hopefully
Austin Medina,Niggas retarded
Degan Nestrichal,"a couple of suicide is a lot! 500,000 deaths is nothing!"
Degan Nestrichal,install my window manager configuration
Degan Nestrichal,"join me in VC im on 2 hrs of sleep, coding a memory allocator in C"
Austin Medina,damn bro me and my friend tom went in a ride in his integra and he had a cv axle failure that resulted in us being towed
Degan Nestrichal,damn
Degan Nestrichal,im gonna go to bed and wake up in 4 hrs
Austin Medina,"good news tho his car is quick as hell when its not broken, he just needs to fix it"
Austin Medina,why waking up at midnight lol
Degan Nestrichal,project due at 4pm
Samuel Adams,Might be in a tight pickle soon boys I'll keep you posted on what I know
Austin Medina,ah shit what u mean sam
Austin Medina,"oh damn, school got you stretched thin bro"
Samuel Adams,Long story short my padre didn't get the social security case and we were sorta banking on that so the future is uncertain for a few things
Samuel Adams,For one I'm almost certainly not gonna get my 1300 back at least not for a while
Austin Medina,i see
Austin Medina,so wait theyre not getting anything from the case?
Samuel Adams,I believe it can be appealed but that's another waiting process
Samuel Adams,"It's nothing but waiting, really, and it's dogshit but what can ya do"
Austin Medina,that sucks man sorry to hear that
Degan Nestrichal,damn is ur family gonna be alright?
Austin Medina,is your family gonna be okay tho like
Samuel Adams,Yeah we'll be fine but it's probably back to living frugally
Samuel Adams,Unfortunately in my dads case he really can't work so there's not much we can do about it
Samuel Adams,I'm gonna have to raise my own funds to get a car because case money or not I can't just wait around to have one this summer
Samuel Adams,Don't worry about me boys I'll be fine I just gotta see what I can do
Austin Medina,we gotta help sam get a bumpin ride bro
Austin Medina,its our destiny
Degan Nestrichal,"i know u prob dread the idea of warehouse work but itd be a good opportunity, a month and a half of that shit and ull have a car"
Austin Medina,i was gonna say u should work at uline if possible
Samuel Adams,"I don't dread it honestly, I know it's hard work but I can probably get into an autopilot routine with it"
Austin Medina,eddie are you gonna work there this summer
Degan Nestrichal,yea
Austin Medina,at least youll have a friend there sam
Austin Medina,ez
Degan Nestrichal,dude sam its ez free ride
Samuel Adams,And they hire pretty much anyone right
Austin Medina,lol they accepted me into it yeah theyll take anyone
Degan Nestrichal,"as long as u pass a piss test, so stay away from weed after april"
Austin Medina,i actually was gonna do that shit until i got hired at the dealership
Samuel Adams,I haven't had weed since that edible so I should be fine
Austin Medina,yeah youll probably pass rn
Degan Nestrichal,they have never drug tested me the 6 months i worked there but they drug tested eli before hire xd
Austin Medina,eli looks like a stoner
Degan Nestrichal,so idk if they are sus they will is probably the protocol
Austin Medina,eddie looks like a hard working mejicano
Samuel Adams,Honestly boys this'll sound weird but I'm just taking this as an omen that I need to get my shit in gear
Austin Medina,doesnt sound weird
Austin Medina,"it just reinforces the fact that there are no givens in life, gotta go what you want"
Samuel Adams,I can't just rest on my laurels and autopilot my way through life anymore I gotta actually focus on what's ahead and not depend on someone else's success
Austin Medina,"exactly, youre the master of your own destiny"
Austin Medina,now u just gotta make a plan and enact it
Samuel Adams,I certainly don't look like a stoner either lmao
Austin Medina,i mean
Austin Medina,kinda
Austin Medina,but anyway just pass the test
Samuel Adams,The long hair is the only thing
Austin Medina,pretty much lmao
Samuel Adams,If I had shorter hair I'm a clean cut white boy who's never so much as touched marijuana
Samuel Adams,Still not gonna jeopardize it though lmao that'd just be my luck
Austin Medina,"true lmao, they wont care about your hair tho im sure its not like youre in a customer service role"
Degan Nestrichal,i know multiple ppl there at uline that had it as their first job so u dont gotta worry about it
Austin Medina,just drink water and stretch right eddie lol
Degan Nestrichal,or just not look like a weed smoking cocksuckey
Austin Medina,im talking about being in shape for that kind of work
Degan Nestrichal,o
Austin Medina,or did you not do anything in particular
Samuel Adams,I definitely gotta start doing cardio
Degan Nestrichal,ur body gets used to it after 2 weeks id say
Samuel Adams,I get tired really easily lately because I'm a lazy fuck
Austin Medina,not necessarily in shape but just being hydrated and shit
Degan Nestrichal,also all the walking is absent minded its usually the most peaceful part of ur day
Degan Nestrichal,yeah drink water and dont skip lunch
Austin Medina,when i start working as a tech im gonna start definitely watching my hydration and how i lift and take care of my body
Austin Medina,"it can be pretty physically taxing, i was helping my friend tyler take out a transfer case and some of those parts are heavy as fugggg"
Degan Nestrichal,i would go thru a gallon before i left work most days
Austin Medina,hell yeeee boy clear skin incoming
Austin Medina,i gotta stop drinking so much coffee and monster
Degan Nestrichal,ikr ur intenstines are gonna fry
Samuel Adams,I drink entirely too much coffee but I'm a blatant addict
Samuel Adams,"I don't know if I actually have time to kick a caffeine addiction lmao, I gotta keep moving"
Samuel Adams,I should've done it over winter break but the flesh is weak yknow
Degan Nestrichal,its gonna be like a week of headaches
Austin Medina,im gonna try to quit caffeine cold turkey tomorrow ill keep you guys posted with how it goes
Degan Nestrichal,austin at 7AM: fug bro i couldnt do it i shotgunned 2 monsters before work so i could feel my heart beat out of my chest
Austin Medina,kek
Austin Medina,probably
Austin Medina,just gonna pack some waters and try to only drink that
Degan Nestrichal,"its tuff, water gets boring when ur used to caffeinated drinks"
Samuel Adams,A week of headaches and constant tiredness would be unsustainable for me! I'm a fucking college student! I can't believe you would even suggest such a thing Edward!
Degan Nestrichal,ye its pretty unbearable
J Cole Patt,Hop on vc lads
Samuel Adams,And if I intend on getting a job this summer I wouldn't want to be irritable and tired at any point during it lol
Austin Medina,i mean could you maybe ween yourself off
Samuel Adams,I'm sure working will do that enough I don't need my own metabolism working against me
Samuel Adams,Yeah I could but where's the fun in that
Austin Medina,maybe i should come work with yall for the summer
Samuel Adams,Caffeine is a drug you can go cold turkey on and be okay you'll just feel like shit
Austin Medina,if i dont get promoted in like 2 weeks i wanna find a new job anyway this organization is kind of shit
J Cole Patt,Come work at Jewel
J Cole Patt,You can live with me at my grandparent
J Cole Patt,grandparents
Austin Medina,me or sam
J Cole Patt,Sam
Samuel Adams,Uline has better pay
Samuel Adams,And it's closer to home
J Cole Patt,Def go there tben
Degan Nestrichal,lmao ur taking a triple L if u work at jewel
Degan Nestrichal,"farther, less pay, more taxes"
Austin Medina,im being serious tho guys if i quit would you mind if i come make some bread alongside you guys
Degan Nestrichal,i would mind! the bread is for me and sam only! 😠
Samuel Adams,Guys we can seize the means of production from that capitalist pig Richard Uihlein!
Austin Medina,do they offer ot at uline
J Cole Patt,THE GENTLE LABOURER SHALL NO LONGER SUFFER!!!
Degan Nestrichal,lol there are no means of production in a warehouse its a storage facility mf 😂
Austin Medina,"i would work there for sure if ot, and then after a while try to find a lube tech job at a better dealership"
Degan Nestrichal,ya know packing all those boxes after like 5 months i realized that uline is just a meta warehouse for warehouse supplies
Degan Nestrichal,"16.25, 24.37 ot"
Austin Medina,god damn with that kind of money i could buy a nice ass car
Degan Nestrichal,ye its just a money farm giv
Austin Medina,sam could also buy a nice ass car
Degan Nestrichal,gig
Samuel Adams,Are they always hiring lmao
Samuel Adams,They always need slaves to run the boxes!
Degan Nestrichal,ye mfs quit all the time
Austin Medina,well they hire through staffing solutions right like temps?
Degan Nestrichal,yes
Samuel Adams,See this is my in to getting a uline internship next year
Austin Medina,i will be ulines dedicated forklift mechanic
Samuel Adams,"It'll be the one thing on my resume, the only thing I know is uline master 🥰"
Austin Medina,lol
Austin Medina,fasho
Degan Nestrichal,austin wut u think of YLM
Degan Nestrichal,lmao whos the 2nd pic
Austin Medina,i would buy this if i made that kind of money
Austin Medina,yellow lives matter?
Degan Nestrichal,yes! 🤦‍♀️
Austin Medina,yellow lives dont matter
Austin Medina,"""D"
Degan Nestrichal,😧
Austin Medina,:D *
Degan Nestrichal,mr uihlein i will be ur sex doll for however long u need me :)
J Cole Patt,Sam join vc i wanna play music w you =(
Austin Medina,Okay so far I have not consumed caffeine I drink some water and one of those naked fruit smoothies I have a little bit of a headache
Degan Nestrichal,"yeah its a rough time, after 2 weeks tho you'll be good"
Degan Nestrichal,"bet you've never written your own dynamic memory allocator, you little faggot"
Degan Nestrichal,this is only one method from the program btw XD
Degan Nestrichal,god my cock is so hard from this program i wrote!
Austin Medina,Im getting a filet o fish today because lent
Degan Nestrichal,o shit austins a based catholic
Austin Medina,Le based christian man
Degan Nestrichal,austin do u think ur gonna work at uline this summer?
Austin Medina,If i dont get promoted soon yeah loo
Degan Nestrichal,its just a money farming gig ya know
Austin Medina,"Yeah, i would work there for a while and then probably leave if i find another automotive job"
Degan Nestrichal,2100 a month for no OT
Degan Nestrichal,then with OT itd prob be insane
Degan Nestrichal,like if u worked sundays
Austin Medina,"Yeah lmao, would be nice"
Degan Nestrichal,i really wanna make it in madison tho im thinking
Degan Nestrichal,its nicer there
Degan Nestrichal,a lot of hiking places and destinations near it as well
Austin Medina,What like move out there and get an apartment?
Austin Medina,Only thing is i dont really have the skills necessary to land a decent job there yet
Degan Nestrichal,like live there
Degan Nestrichal,gonna try hard to land an internship there for summer 2022
Degan Nestrichal,then hopefully get employment there shortly after
Degan Nestrichal,just say im a young male latino immigrant programmer and they will be shocked :o
Austin Medina,"I mean shit by then i can move there lol, im tryna save up for a house"
Austin Medina,Hopefully will have some decent experience too
Austin Medina,I like green bay too
Degan Nestrichal,bro austin at madison u will literally never run out of hot 18 yr old college chicks!
Austin Medina,Bro i am a man of faith i do not fuck women i make love to them
J Cole Patt,Austinian medinian
J Cole Patt,Are you free tomorrow?
Austin Medina,I mean im working tomorrow till 1 pm but maybe after that
J Cole Patt,u pick me up
J Cole Patt,We go get sam
J Cole Patt,We get guitar on way back
J Cole Patt,@Samuel Adams get the adress for that guitar
Austin Medina,That could be fun
Austin Medina,Yeah im down bro
J Cole Patt,bass***
Austin Medina,Sam lemme know if ur down
J Cole Patt,Sam would u b cool with getting picked up rn?
J Cole Patt,O ye also
J Cole Patt,I got a futon here now
J Cole Patt,For austin to sleep on.
J Cole Patt,Instead of a bean bag
Austin Medina,"Nice, that would be the swag"
J Cole Patt,Ye im gonna be in racine
Degan Nestrichal,ive been the one sleeping on the bean bag..
Degan Nestrichal,😡😡😡😡
Degan Nestrichal,ok master :)
Samuel Adams,I've got plans later tonight but yeah I'm down tomorrow
Degan Nestrichal,wut could u possibly have planned on a friday night??
J Cole Patt,🇮🇪
J Cole Patt,im just offeeing to take u home
J Cole Patt,not mi place
Samuel Adams,Nah I'm not going home this weekend
Samuel Adams,Probably next weekend or the one after that for sure
Austin Medina,Okay so we pick up sam tomorrow after 1 pm
Degan Nestrichal,OMG no i dont wanna hang out with sam dont tell him i said dat tho
Degan Nestrichal,im gonna prob sleep for 24 hrs
Austin Medina,Sam eddie said he wants to slobber on your knobber
Degan Nestrichal,ive gotten no joke around ~4-5hrs in the past 4 days
Austin Medina,Dont kill urself bro
Degan Nestrichal,i mean its either dat or fail
Degan Nestrichal,this fucking program was a 1000-line ish low level assignment
Austin Medina,So is every cs major going thru this
Degan Nestrichal,low level as in low level programming language
Degan Nestrichal,i built my own memory allocator 😎
Degan Nestrichal,probably
Degan Nestrichal,i spent like 2 hrs looking for a bug
Degan Nestrichal,that was literally just like 1 line where i absent-mindedly put something stupid
Degan Nestrichal,when ur tired/drunk bugs are hard af to find
J Cole Patt,This sounds gucci
Degan Nestrichal,ye J ur gonna love it
J Cole Patt,Woah wait what
J Cole Patt,Why aint u sleeping right now?
Degan Nestrichal,the funny thing is
Degan Nestrichal,that i have a quiz today too
Degan Nestrichal,ha ha ha
Samuel Adams,Eddie just become a business major and drink for your degree because networking is a vital part of the experience!
Degan Nestrichal,fk ur rite
Samuel Adams,Pineapple new am is pretty good but fuck I didn't even drink that much and woke up hungover
Samuel Adams,Am I past my drinking prime already
Degan Nestrichal,i have some red berry new am
Degan Nestrichal,J took 4 shots of pink whitney and was like 🤮🤧😴
Degan Nestrichal,sam just tek mee discrete math quiz for me
J Cole Patt,I did chug it tho
Degan Nestrichal,the fibonacci numeros are 0 1 1 2 3 5 8 13 21 34 55
J Cole Patt,?
Degan Nestrichal,0 1 1 2 3 5 8 13 21 34 55 89
Degan Nestrichal,144
Degan Nestrichal,233
Degan Nestrichal,377
Degan Nestrichal,610
Degan Nestrichal,987
Degan Nestrichal,im just warming up
Samuel Adams,I stare at the ceiling
J Cole Patt,"Ah yes, such a amazing ceiling"
J Cole Patt,Pov you are my ceiling
Samuel Adams,POV it says “gullible”
J Cole Patt,"Mo didnt need to lie, come get a vaccine."
J Cole Patt,Mo says why yall worried abt anything
Samuel Adams,Did they not ask about his work status at all or what lmao
J Cole Patt,Come get vacced and then you can jam at my grandparents
J Cole Patt,they did not
Austin Medina,Imma come get vaccyd
J Cole Patt,"No ID either, p basic info"
Samuel Adams,We should vaccinated tomorrow no cap
Samuel Adams,Unless they don't do it on weekends
J Cole Patt,It didnt hurt at all.
J Cole Patt,Litterally I felt nothing tbh
Samuel Adams,I'm not worried about a vaccine I just don't wanna be the dumbass who gets turned away for not being a priority lmao
J Cole Patt,You wont get turned away
J Cole Patt,Didnt see anyone turned away
J Cole Patt,It was p neat
Samuel Adams,How many people were there do you reckon
Degan Nestrichal,sam is so scared of standing out! what a sheeple!
Degan Nestrichal,sam just pretend ur this guy and walk in there
J Cole Patt,Nah just say you work at some rando place ig idk
Samuel Adams,I'm gonna show up and they'll run out of doses! Dumbass!
Austin Medina,man how u niggus doin
J Cole Patt,Jan 23rd I am moving back
J Cole Patt,Wai
J Cole Patt,April 23rd
J Cole Patt,Sam
J Cole Patt,Get vaxxed
J Cole Patt,As well as the rest of you boios
Austin Medina,"I will if i can, dont rly have much time"
Austin Medina,How long did it take
J Cole Patt,Not long at all
J Cole Patt,P quick
J Cole Patt,Like
J Cole Patt,20 min
Austin Medina,ok where did you go
J Cole Patt,Racine
J Cole Patt,You gotta wait a lil bit in a waiting room
J Cole Patt,for 15 min
Austin Medina,where at tho in racine
J Cole Patt,Just in case you have a raction to it.
J Cole Patt,Festival hall
J Cole Patt,5th street
Austin Medina,ill look into it
J Cole Patt,This website
J Cole Patt,Checj out the times they got n such
Samuel Adams,There's no times on here kek
Austin Medina,"a lot of places are saying theyre opening vaccination to the general public in like april anyway, if i cant get it now its only a month or so away"
J Cole Patt,Oh fucj
J Cole Patt,There is no times
Austin Medina,what else yall tryna do tomorrow
Samuel Adams,Yall wanna pretend to be marquette students
Samuel Adams,53233 is my zip code
Austin Medina,LMFAO
J Cole Patt,Lol
Austin Medina,nah im not that thirsty
Samuel Adams,I think I just gotta print out a copy of my mashuda residency
Austin Medina,sam you should buy a ford ranger
Samuel Adams,Tell me about it
Samuel Adams,I've been wanting to get a 4 door or club cab at least though
Samuel Adams,Gotta take the homies around
Austin Medina,put us in the bed
Austin Medina,no cap tho ford ranges are great trucks i would whole heartedly approve
Austin Medina,i kinda want one myself but im not tryna get another car
J Cole Patt,Gerald b picking me up some gucci stuff
J Cole Patt,For you bois tomorrow
J Cole Patt,It b Rum
J Cole Patt,Sam
J Cole Patt,Join discord damnit!!!
Degan Nestrichal,he cant he told me he is performing goodbye my little kitten tonight for some fraternity
Degan Nestrichal,shits gonna go wild
Degan Nestrichal,and i crawl back to bed now xD
Samuel Adams,It was wild
Samuel Adams,Got some crowd surfing going and everything
Samuel Adams,Wasn't expecting that reaction to my music kek
J Cole Patt,Neato
J Cole Patt,"Austin, what time did you want to go, imma set a alarm for like, 1pm"
Austin Medina,As soon as i get off
Austin Medina,1 PM imma start heading north
J Cole Patt,Pick me up first
J Cole Patt,I must come with
J Cole Patt,Might need my wallet though
Degan Nestrichal,i hear my neighbors at each others throats last night yelling and screaming then this morning i wake up to them having loud sex dafuq
Austin Medina,I was in a scat pack earlier
Degan Nestrichal,austin picc eh me up?
Austin Medina,Sureeee idk if its gonna be a comfy fit but ill pick you all up
Austin Medina,6.4L v8 mated to a 6 speed manual @Samuel Adams thats some fuckin muscle
Degan Nestrichal,@J Cole Patt u still want the keyboard?
Degan Nestrichal,we should go to some sit-down restauraunte
Degan Nestrichal,"its been a while, i know of this one good thai place in racine if ur down to make it there austino"
Austin Medina,Yeah thats fine
